company_link,company_name,job_link,job_location,job_summary,job_title
http://www.indeed.com/cmp/Indeed,Indeed,http://www.indeed.com/pagead/clk?mo=r&ad=-6NYlbfkN0CiRNM7CVr8YueLFKlzwbFWI0o7IjV438l4sVrvKZ0fliTfoNv_ONF5FvJKNaJe41O5vUOqHByFV-Kbj5Y3ThgQQObxPdR8ypSHPTD0Fer3x1OFY1fvzVKlLPcdMTrwb68jqlrGSZRldd8bqmPUGuD245UY7fWzD5pqxMGMvhZnD7C5MTH-3mLdXiTHmDdUZZ3b3jwrozzmwnC-gB7cCHOPVVDdcxMetQnti2XmQl8vXfS2EvBjQ7o8k-wjpVEyDWKqHCKn4144LoI7ST464hb6LQh_5RwFt1ECg2J5orOfcm_nbAc5qnWkmFRY73EWjt_GMHG6zQnQGjbL-4o5yGIFgJZNl70CnHkn5KrGjl4hjptgwpSDdKxsYyi8TkPVR3E7QjJzayDwNQqe9OT3iNGv8pNI1YFz067BV8OrDGyemJbGLm4nSp9lFfSdLIiNVEJjW_Eq168Qc-1zIhlqpJfdBpC8BAu56GagfJV75oo8xg==&p=3&sk=&fvj=0,"Austin, TX 78731","As a Data Scientist at Indeed your role is to follow the data. We are looking for a mixture between a statistician, scientist, machine learning expert and...",Data Scientist
http://www.indeed.com/cmp/American-Chemical-Society,American Chemical Society,http://www.indeed.com/rc/clk?jk=3ff96611bc032d2b&fccid=aa2c3da9385f84b6,"Columbus, OH","At CAS, a division of the American Chemical Society, we are scientists, technologists and business leaders who continuously and passionately pursue new...",Operations Platform Architect
,QuintilesIMS,http://www.indeed.com/rc/clk?jk=d69cc9a62cfac789&fccid=441bfd1012ef997e,"Plymouth Meeting, PA","Health Economics & outcomes research, multivariate analysis, regression analysis and forecasting, sampling, data modeling, R programming, machine learning, SPSS...","Senior Manager, Statistical Methodology"
http://www.indeed.com/cmp/Dana--farber-Cancer-Institute,Dana-Farber Cancer Institute,http://www.indeed.com/rc/clk?jk=c5f9e6d15f89c3b9&fccid=31a15643b156b0a5,"Boston, MA","This position will assist scientists in performing scientific research, development and/or clinical tasks of varying complexity....",Research Technician
,Placed,http://www.indeed.com/rc/clk?jk=d15c7b23d8ac1771&fccid=355c1374e60578f1,"Seattle, WA","As a player-coach for the Ad Research team, you will be wrangling and modeling data using the latest scalable data science toolsets as well as directing the...",Director of Research
http://www.indeed.com/cmp/Natera,Natera,http://www.indeed.com/rc/clk?jk=8a5264afa31fe99c&fccid=76d4cf3f28c81122,"Austin, TX 78731","The Natera team consists of highly dedicated statisticians, geneticists, doctors, laboratory scientists, business professionals, software engineers and many...",Billing Correspondence Representative
http://www.indeed.com/cmp/Reed-Elsevier,Reed Elsevier,http://www.indeed.com/rc/clk?jk=2bf1d82aceb0fcd4&fccid=f7a0f0e88ce3d78e,"Alpharetta, GA","Develop, manage and execute innovative procurement strategies, based on relevant analytics of procurement spend and activities, demonstrating strong subject...","Manager, Procurement"
http://www.indeed.com/cmp/Central-Peninsula-Hospital,Central Peninsula Hospital,http://www.indeed.com/rc/clk?jk=e789751a1ad43f2b&fccid=9ca28f2c054138e8,"Soldotna, AK","Clinical internship required, Clinical Laboratory Scientist (CLS) or Medical Laboratory Technologist MT (ASCP)....",Medical Technologist II
http://www.indeed.com/cmp/Eli-Lilly,Eli Lilly & Co.,http://www.indeed.com/rc/clk?jk=96ade6835bbc6787&fccid=ac8d156b339793e6,"Indianapolis, IN",Keep abreast of relevant scientific literature/new technologies/capabilities. Contribute to the general scientific community through external publications....,Post Doctoral Scientist-Process Design and Development-FDE
http://www.indeed.com/cmp/The-Aerospace-Corporation,The Aerospace Corporation,http://www.indeed.com/rc/clk?jk=15f6ce108a1ee371&fccid=ba923b146fa75d0d,"Washington, DC 20535 (Downtown area)",Our state-of-the-art laboratory facilities are staffed by some of the leading scientists in the world. Aerospace's Vaeros Division is seeking a Senior Project...,Senior Project Engineer for Data Center Optimization
http://www.indeed.com/cmp/Natera,Natera,http://www.indeed.com/rc/clk?jk=adef7107c9e9540a&fccid=76d4cf3f28c81122,"Austin, TX 78731","The Natera team consists of highly dedicated statisticians, geneticists, doctors, laboratory scientists, business professionals, software engineers and many...",Billing System Configuration Coordinator
,"Syntelli Solutions, Inc",http://www.indeed.com/pagead/clk?mo=r&ad=-6NYlbfkN0Dqrr-Rjg2XLksGNbp1zr5zrpCZUmaYUPA5zQ_vrCj_X6a_99tNJpNpXW6b2-NnzR-s72LGlIrkkvWFRwr2frmiwkGfTVc8Qgg6uKo4D4z8Hcb6niEHqdp_J0Q9g6aYSoYTmug_FVffV-BytzsyRywaCxUNkbvQPS3j2_Q0US59RUHuEgVgX-MmiYaZILyVhH3FWdUq5uh5HQpBsgGlf3H4psI-P_mP0XhaMFfzVn6ywKYkVS9mqwVwtNh7aMXuFCFc0ihmb4lStEscBzk29VUT1IwNqcteBuHsq89qPmvEShLGfuHR6QWrxHfQCxh_8rKpV6_cF8uXz0U7Y4i8sD6KR0bB1SsslqDkra7EDQieGWDvrHJdSzxu9JACjGH6Sy6L7xmK29VYXm4tdqliTC4r_LYqxb5MtPAlW-JD_VGJ6g==&p=4&sk=&fvj=1,"Charlotte, NC 28277",Senior/Lead Data Scientist:. 2+ years as Senior/Lead Data Scientist. Lead role in our very fast growing Data Science team from marketing analytics perspective....,Data Scientist
http://www.indeed.com/cmp/Novetta,Novetta,http://www.indeed.com/pagead/clk?mo=r&ad=-6NYlbfkN0DZbghDog6eAFViHltrtimeH7IE6OveQ-GQud_7SkddKZ31ufd3YNXn3pfpzCV9ckU8aF4FXEMdNMMuriPqwkORncW9ijpAUQMteJKA5qO_YPdZyJ6yQp__XO5UMaH6318gaUwG-w8bOd8Y2RsOBx_R7CzZZB3tZ60u70vmULdHzPbfAuGbyyPjzJWo40nkKcWXsbbn7yjRUV8PP2AiXpYldxp-sHUYn71ZHiN0WoAxKo6H0V7DZ_9AYqLKoFXY7fy1Ti2682ZIzAixPWjKXQuq1qiFPsFZeXDdoVKa2e-IrvR2KuR7GrkzUZgKm8vzNO_UYkSrRHU2K98fcrUMQEVv4dSMv03du16Q1O3Gki4adiKmze_vdsobk9T-w8ZPutTnjKQuhqjckBSi5neLV3wlDKOofy8xFm1VEVTtgjMmdRSg9u08onG2kCaSKuZHHCwkKJKejWcjuMVuvV8kiAn5ak_T7NpMg1nexx3zlwet9NGJrCw9_1_pipmqWSE9yZT_NEGpOLCN1uU-y938xAw5woaWC4DJ5dzQQQZQ_80tVD11_xwS0Raz21H2zBShYaP6cwNn87Ut9DKQEt5_kDszXE2rCAIvQrpEjLjPpSnJ4yZwxJ1OuQg9u9xCx8-EWvIJgdQAv4tnTfwy-nC3OggfB54W2h0vBv0q_ZonfPmWVOqZ9hZVJrIMXeQqdbkXOAey2jnkS17RVMAkspAuvzDMTnE-8PY2o9BWFY_rMDu9DpVJaIO_cxkR5jdKknddXjZ7BRumSeCU-W7y8sb8glqPaChURVJSs21BE54XZm09o7YhGZdQe58Oo0MI6zNP6uSpTFSieTy0LZp5-fa4EbGC&p=5&sk=&fvj=0,"Crystal City, VA","Experience applying data mining and machine learning techniques in a professional context. Knowledge of data mining and machine learning algorithms, theories,...",Data Scientist
,RS Energy Group,http://www.indeed.com/pagead/clk?mo=r&ad=-6NYlbfkN0AH4CKTkdT7E9kgGwiXtXtW04LsQVpZIo66s4kKwqvZTs19CBU-WfuablWFA-ZRFrlupi55B-j6m7nyTCH8RGDG80ArvTQlgPWVEK66fO4m5yrXI147eteX_rz9xEtjLzbPOdCWLu9z3nqT-BxQUrhifPoHz5st16hX3z8f1oWWEYiPRrfLF1hDD1oAOsYmE21XuxuRGr1inj9peXZu_qs7Av872qPK_ty5G_SijgInCO0XFae3SlChR8_IfxsPTLPXjuSmNDLhHGSxM5PLSoBNIkt79FHZ2U1T9jbUzMnLVWd-WxwbTTukENXsSA-zbyiFXoLVeFELhRCbTa9te0aPDUSpaRO1A0AgisPfilqli_IAJEcWg7758Oz8BLc_b5N8ktnnG_mfT3leclE6t-VXZq8Ju_4-tv6cY0mJbnOVuLj6wMgkCT59&p=1&sk=&fvj=1,"Plymouth Meeting, PA",Working alongside Data Scientists to productionalize advanced computer science algorithms like machine learning and natural language processing....,Data Engineer/Scientist
http://www.indeed.com/cmp/Walmart-Ecommerce,Walmart eCommerce,http://www.indeed.com/pagead/clk?mo=r&ad=-6NYlbfkN0ASqHCEO9GpEUGjkXl8JxXxJB8G4bxm4-V1wqiPq6GTVg0dexUg4LUC1Xvy-Hj3JfvgW6Kn5vqROfEP7DBmdabnwGqVZXSr7gqBOaZltwR5TlPJtKzwqE1-IO0CXhoGzDGP3SoNTUll16uKR-Ip-64np3GuP5qjlvRYI5SlMnj9-gG_TFKosd9vdK2Eu2fUJHyB6QxaUU6V9-O7S1uZbtRVULk-N3PHMsEG26cbavEfssoSKg8tX1j2jFBI5KZ539HtN_fbrmYa8ttCYu5-w8-9rdj_WxBwpVzhkReQmnDX4oIlx7O8vemKD2KIuRBCRmQBJAkOquaz9mIEmPtGfGfR-1odVEde0snsMAcO--EtsJ6ZceBpT_8z0uHc9PAoKs-jlFkTkS_1XAOycHdn8Y4k&p=2&sk=&fvj=0,"San Bruno, CA 94066","We employ big data at scale -- from machine learning, data mining and optimization algorithms, to modeling and analyzing massive flows of data from online,...",Data Scientist
http://www.indeed.com/cmp/Indeed,Indeed,http://www.indeed.com/pagead/clk?mo=r&ad=-6NYlbfkN0CiRNM7CVr8YueLFKlzwbFWI0o7IjV438l4sVrvKZ0fliTfoNv_ONF5FvJKNaJe41O5vUOqHByFV-Kbj5Y3ThgQQObxPdR8ypSHPTD0Fer3x1OFY1fvzVKlLPcdMTrwb68jqlrGSZRldd8bqmPUGuD2famXPFhLER4xtE8cFPMCfvUL1LH1zkZkoiKSZvftiWX9kDbCbcD52m19Z-hSLPKyxqWsYetZarw3_J7nC4Ku_GXUAq5gcunBlPbNRQ-LfXL2lvkyeJZNcDIBEMVmvxRz5KoUeBFW_RJ0EXuAE8W3rm6ehkvVZxQM-jVxQl2B2f9vcMoKPXHDP-WxVpQpYt9fl84jZBkIciO0KunMqJzVZYLXOfiVgtujHeEoowOQWjv1vpmkm83sFK-JnOqtwjaDarJkZvT4eYrJDybpFSIDD7LV2LzFeswxi4HV3-lwpVujYb6XPbtdIZmivb-MQd08G0eSikWS6X0ywB4wAfqJeA==&p=3&sk=&fvj=0,"Austin, TX 78731","As a Data Scientist at Indeed your role is to follow the data. We are looking for a mixture between a statistician, scientist, machine learning expert and...",Data Scientist
http://www.indeed.com/cmp/The-Aerospace-Corporation,The Aerospace Corporation,http://www.indeed.com/rc/clk?jk=15f6ce108a1ee371&fccid=ba923b146fa75d0d,"Washington, DC 20535 (Downtown area)",Our state-of-the-art laboratory facilities are staffed by some of the leading scientists in the world. Aerospace's Vaeros Division is seeking a Senior Project...,Senior Project Engineer for Data Center Optimization
http://www.indeed.com/cmp/State-of-Arizona,State of Arizona,http://www.indeed.com/rc/clk?jk=ac987af5057017fc&fccid=ac9531a4aa5791eb,"Phoenix, AZ","ADEQ administers a variety of programs to improve the health and welfare of our citizens and ensure the quality of Arizona’s air, land and water resources meet...",ENVIRONMENTAL TECHNICIAN
http://www.indeed.com/cmp/Wunderman,Wunderman,http://www.indeed.com/rc/clk?jk=3b72cd0b9f8798e5&fccid=bfef2b2da6904e2a,"New York, NY 10017 (Midtown area)","Headquartered in New York, the agency brings together 7,000 creatives, data scientists, strategists and technologists in 175 offices in 60 markets....",Senior Project Manager
http://www.indeed.com/cmp/New-York-University,NYU School of Medicine,http://www.indeed.com/rc/clk?jk=ccbfd955eeb94201&fccid=8077183a161ef0fd,"New York, NY","It also includes NYU School of Medicine, which since 1841 has trained thousands of physicians and scientists who have helped to shape the course of medical...",FGP Billing Coordinator
http://www.indeed.com/cmp/Uber,Uber,http://www.indeed.com/rc/clk?jk=5cdcb0823c702d4d&fccid=f766f8bfbc3effb7,"Palo Alto, CA 94304","We are looking for a strong, Senior Engineering Manager who can help identify the key open challenges, create a viable road-map and lead a team of world class...","Senior Engineering Manager, Maps"
http://www.indeed.com/cmp/Merck,Merck,http://www.indeed.com/rc/clk?jk=67d731f1a1557fdf&fccid=c38b7d5e0419a6a7,"Cambridge, MA","Co-located with Merck’s Cambridge Innovation Hub, the ESC’s disease-area-agnostic research agenda fosters hands-on collaboration between our scientists and...",Medicinal Chemistry Scientist Job
"http://www.indeed.com/cmp/Qps,-LLC","QPS, LLC",http://www.indeed.com/rc/clk?jk=82782813e79c5cba&fccid=a3d0fe8cba90951c,"Newark, DE 19711","Author scientific papers to be published in peer reviewed journals and presented in scientific meetings. § Supervise, train and/or mentor junior scientists....",Research Scientist - Bioanalytical DMPK (Oligonucleotides LC-MS/MS)
http://www.indeed.com/cmp/GE-Corporate,General Electric,http://www.indeed.com/rc/clk?jk=b3a47a6efb3ef310&fccid=c5c99ec01e2125aa,"Roanoke, VA",How data scientists create complex analytics. What visualization tools data analysts need to interpret sensor data from a gas turbine....,UX Interaction Designer
http://www.indeed.com/cmp/Procter-&-Gamble,P&G,http://www.indeed.com/rc/clk?jk=e081ea0ddd4ca357&fccid=2da0dedf6df97194,"Cincinnati, OH","Partner effectively with global colleagues on a multi-functional, multi-disciplinary team (e.g., Analytical Scientists, Clinical Scientists, Statisticians) to...",Research and Development - Postdoc - Vibrational Spectroscopy and Chemometrics
,Earth Engineering Incorporated,http://www.indeed.com/rc/clk?jk=6f47eebcd3768589&fccid=60dbf17182d3392c,"East Norriton, PA 19401","EEI has positions available for degreed geologists, earth scientists and geotechnical engineers. Positions are available from entry level to project management...","Geologist, Earth Scientist, Geotechnical Engineer"
,"Syntelli Solutions, Inc",http://www.indeed.com/pagead/clk?mo=r&ad=-6NYlbfkN0Dqrr-Rjg2XLksGNbp1zr5zrpCZUmaYUPA5zQ_vrCj_X6a_99tNJpNpXW6b2-NnzR-s72LGlIrkkvWFRwr2frmiwkGfTVc8Qgg6uKo4D4z8Hcb6niEHqdp_J0Q9g6aYSoYTmug_FVffV-BytzsyRywaCxUNkbvQPS18hvNy1gYAuB7YYmbLFoi1XsX4oM3OxEDrruwD6Oid0USKEXUTGhUlseSJCu3-Qh0eBAWiYOWxFKmAD_ZE0WD8Pb89CIWEPKCfUii8JoRBzFSSVR6LE2A7YXxR-RusPhm44DwcYibVtHKZdzz7OkNfE6Lcl2PjSRZYak0AKVBzQG-nRabrNTI8UQCeuDOmugcgEI3BceOFDzcSmZaCssnHc_A-B_UH0wK2X9YO7J_sNXKhq7rZq4baoZguqQlOgcPmwSIcBIsGig==&p=4&sk=&fvj=1,"Charlotte, NC 28277",Senior/Lead Data Scientist:. 2+ years as Senior/Lead Data Scientist. Lead role in our very fast growing Data Science team from marketing analytics perspective....,Data Scientist
http://www.indeed.com/cmp/Novetta,Novetta,http://www.indeed.com/pagead/clk?mo=r&ad=-6NYlbfkN0DZbghDog6eAFViHltrtimeH7IE6OveQ-GQud_7SkddKZ31ufd3YNXn3pfpzCV9ckU8aF4FXEMdNMMuriPqwkORncW9ijpAUQMteJKA5qO_YPdZyJ6yQp__XO5UMaH6318gaUwG-w8bOd8Y2RsOBx_RGo1mYIArLKWgz96oWqitHPaO-a_0qxrJRUn27IdbK655oBmFta3-sdsXUlq94peiD0t4hvr0dvvJm3KnljTAjuDVY9v_IQz9j6Cd1ohbkhaeMz7UR3mK-2h42zGorM0PRVxAToA_w5dFpFh6uaHD5VZvkCtftF72y1QWTT--NfZhuHHYZgyHrT693KBdUKzpr4CEKoI1Qq0W_d8mwhl5tj2CN_XG4ib1Z5vQsUWrfuy9m3C8cWuzyVqORzIYdEscH7h--hvRPRZ_YA-0LhEC2ywFAsbFYGVh97iCsAr1xyct_UMqcIB1rJzxz78C8IIOIfbsrF2JbC2y4VR8nfC_GXxazV0JNHNib8To2JkDxr8NVRK927jMSAc6OGhqYJi9WcIYFI4y9UrgGp00GEGiX3JS3o-Gk12S3DA_rF2mJAH0Pk9ATKtYz2pBaIRR4fBOPcvYdS5Vjz3K-1zrI93M-JR0DXVjTf7VplZdYddbj3rHn5zP7SQDaIOg_xDi9ET8jNmFzpBQOHjfzK-zdKN1G_7fU7T14IOfDg6DkesLc-X-vQDv_KFBrFhgo6AnpgWDT87wrvENWdvdPuRGWE9Y3VwVvoUp0fLcZDs-jKe5wozRp-Xy2T0lb259zUqS5EY_PHiPycJ6qjzJ3tXqQGGsu6ZCgaRJp5hauYKP9TbgvUMplHAQR6kRA1snh9B-p7Zj&p=5&sk=&fvj=0,"Crystal City, VA","Experience applying data mining and machine learning techniques in a professional context. Knowledge of data mining and machine learning algorithms, theories,...",Data Scientist
,RS Energy Group,http://www.indeed.com/pagead/clk?mo=r&ad=-6NYlbfkN0AH4CKTkdT7E9kgGwiXtXtW04LsQVpZIo66s4kKwqvZTs19CBU-WfuablWFA-ZRFrlupi55B-j6m7nyTCH8RGDG80ArvTQlgPWVEK66fO4m5yrXI147eteX_rz9xEtjLzbPOdCWLu9z3nqT-BxQUrhiWjK53GH3dx8defTQ4eRRcjQZIqlhhjyAdFWlUFwJc7dXwAK0tPu5YRVc25MrVImXDTP1fvUGD5qxDN_PqL6mRsO9Nu02Kmz70xeItJtnJcB0CyUZe9Fra4BJNPKib_i6DfVONwPUTYAhDO9Qg1-3ZJq898mdU-GFPqsw1JfCWjq6z296Zo6rNk9H-NVNrMzbFtE2EXFdrjjdafJ7X1AJ8CGSZB9kcax_o39yKlKwFthUoZTeroBFCESPA-c8ocgpo9ICZE4EknOOtF9_ooxh8lRkO8c-_nb3&p=1&sk=&fvj=1,"Plymouth Meeting, PA",Working alongside Data Scientists to productionalize advanced computer science algorithms like machine learning and natural language processing....,Data Engineer/Scientist
http://www.indeed.com/cmp/Walmart-Ecommerce,Walmart eCommerce,http://www.indeed.com/pagead/clk?mo=r&ad=-6NYlbfkN0ASqHCEO9GpEUGjkXl8JxXxJB8G4bxm4-V1wqiPq6GTVg0dexUg4LUC1Xvy-Hj3JfvgW6Kn5vqROfEP7DBmdabnwGqVZXSr7gqBOaZltwR5TlPJtKzwqE1-IO0CXhoGzDGP3SoNTUll16uKR-Ip-64nto0Ni8x_dh9FbIKB8Iq9AImJGnK5JzsJFRdoPHwoKgM0crLXh9e4i2w6CF10hys3H_46UA1-6vUrxuKgG1CZrODPU0Dbp2eX392-wJEi9I3ZPaX_pCK9QmNFM7-_RBlLT7SBAcpq36yxpU23dsbm3Fv7FaYpRXra93agO5qx0Bnig5EFyJFQkaJicGnKYQIehHN7S6Z7jruYAUuMnamKGqrZvW7tZtnwJjoxm8iUXjWHCgriA9a91sMszgZLjY4T&p=2&sk=&fvj=0,"San Bruno, CA 94066","We employ big data at scale -- from machine learning, data mining and optimization algorithms, to modeling and analyzing massive flows of data from online,...",Data Scientist
,"Syntelli Solutions, Inc",http://www.indeed.com/pagead/clk?mo=r&ad=-6NYlbfkN0Dqrr-Rjg2XLksGNbp1zr5zrpCZUmaYUPA5zQ_vrCj_X6a_99tNJpNpXW6b2-NnzR-s72LGlIrkkvWFRwr2frmiwkGfTVc8Qgg6uKo4D4z8Hcb6niEHqdp_J0Q9g6aYSoYTmug_FVffV-BytzsyRywapYtRxTJL6iI5bNXH7watyon8igxWW4gq3nkTzoN2ZPawCEZZvYQGzX3q9SOHeti4Ubrwm7xCbNtbzMoqIX2t6tCRmhPVexFdXUcI6LpDhv0VouHNb2wyKggzOFNtRU29XEPSOmM_8EKxjzCJBkQnxfGqsYXfh2B7f8I9MqVZxDt_0q3wbAzg1b8WMRPNpo1Zumj-PWXtBbyysWlmDbaiXdoULyZa381HJlcCpdyejpFRDfdurjlRUDYKFmGJjnzYJRkBRD7yq1KOkH_Ats2Sww==&p=3&sk=&fvj=1,"Charlotte, NC 28277",Senior/Lead Data Scientist:. 2+ years as Senior/Lead Data Scientist. Lead role in our very fast growing Data Science team from marketing analytics perspective....,Data Scientist
http://www.indeed.com/cmp/Hdr,HDR,http://www.indeed.com/rc/clk?jk=6e2020aa9b44ca9e&fccid=c3725c584175877c,"Bellevue, WA 98004 (Downtown area)","We create an unshakable foundation for progress because our multidisciplinary teams also include scientists, economists, builders, analysts and artists....",Project Accountant 1
http://www.indeed.com/cmp/Procter-&-Gamble,P&G,http://www.indeed.com/rc/clk?jk=e081ea0ddd4ca357&fccid=2da0dedf6df97194,"Cincinnati, OH","Partner effectively with global colleagues on a multi-functional, multi-disciplinary team (e.g., Analytical Scientists, Clinical Scientists, Statisticians) to...",Research and Development - Postdoc - Vibrational Spectroscopy and Chemometrics
,Earth Engineering Incorporated,http://www.indeed.com/rc/clk?jk=6f47eebcd3768589&fccid=60dbf17182d3392c,"East Norriton, PA 19401","EEI has positions available for degreed geologists, earth scientists and geotechnical engineers. Positions are available from entry level to project management...","Geologist, Earth Scientist, Geotechnical Engineer"
http://www.indeed.com/cmp/Greenway-Health,Greenway Health,http://www.indeed.com/rc/clk?jk=bf5b0655ea22dceb&fccid=208a2f01ba681cc1,"Tampa, FL",Management of market intelligence fact book – monitoring and aggregating metrics of key market trends and data....,Marketing Research Analyst
http://www.indeed.com/cmp/Zions-Bancorporation,Zions Bancorporation,http://www.indeed.com/rc/clk?jk=c854d0e981f5d048&fccid=f48844f8f6150eee,"Salt Lake City, UT","2-4 + years’ experience in product, data or financial analysis, data modeling or other directly related experience....",Quantitative Product Analyst – Retail Deposits & Lending Product Management
http://www.indeed.com/cmp/Providence-Health-&-Services,Providence Health & Services,http://www.indeed.com/rc/clk?jk=f5aa20292ef4a5fd&fccid=b983e0b562a36362,"Santa Monica, CA 90407",Providence Health & Services is the third largest not-for-profit health system in the United States. Training the next generation of surgical scientists who...,Postdoctoral Research Fellow - Translational Molecular Medicine ( Full Time - Day Shift )
,Apex Life Sciences,http://www.indeed.com/rc/clk?jk=c0ae3c7012fbf29d&fccid=41d6cbba9d1258c7,"Alachua, FL 32615",B.S Degree in scientific field; The Downstream Scientist - Protein Purification. Qualifications for the Downstream Scientist - Protein Purification....,Downstream Scientist - Protein Purification
,Penfield Search Partners,http://www.indeed.com/rc/clk?jk=4e9f987f7fe656f7&fccid=5d807087f2960e47,"Philadelphia, PA","They are now seeking several Biostatisticians at varying levels to provide statistical, clinical data management and programming support....",Senior Statistician to Associate Director Biostatistics
,"QPS, LLC.",http://www.indeed.com/rc/clk?jk=6ae9f81302a47584&fccid=999d30389c0756ef,"Newark, DE 19702","This position is accountable for overall conduct and management of in life portion for pharmacokinetic, mass balance, and WBA projects, sample and data analysis...",Director - in vivo ADME
http://www.indeed.com/cmp/Analytic-Recruiting,Analytic Recruiting,http://www.indeed.com/rc/clk?jk=a55173ce628f444d&fccid=3b4e0f2c2deb87d6,"Boston, MA","Statistical Programming, R, SQL Database, Investment Management, R, Java. Must have strong Java, R, SQL Linux programming skills....","Quantitative Statistical Developer (R/Java, SQL/Database) Investment Models"
http://www.indeed.com/cmp/Indeed,Indeed,http://www.indeed.com/pagead/clk?mo=r&ad=-6NYlbfkN0CiRNM7CVr8YueLFKlzwbFWI0o7IjV438l4sVrvKZ0fliTfoNv_ONF5FvJKNaJe41O5vUOqHByFV-Kbj5Y3ThgQQObxPdR8ypSHPTD0Fer3x1OFY1fvzVKlLPcdMTrwb68jqlrGSZRldd8bqmPUGuD2wduLuxLh8XtyA-Y6emj77Iuu7Gw-Msd4yloET8xqDSBhfYA662NPWCguiNTca8_571LqRWBT1tLI-QckIY8VKSr4iCLCuky1wAjO8IvWUKqP0a7FSx-wDeW4lHdPm4QcHJB-IJ7CUlk3REVtuByh1c2dsLspBliPDiRuJm4ClSVz3MlHLinWnvlb9S2z70lZcIXa9EtHzCmYb_7jpn2gKjJGU2GnNFMpicI_bLj_F7VMCqSt2KQMpczig0GkhEZikhJ4xpmjSfyriG1J9M0MQ_ejcdMV0V0GL_uDFer6UCG0omwI3mlJ7fKmqKT9YMyYpJ_nRVaqb5_3Bt3F_zYEHg==&p=4&sk=&fvj=0,"Austin, TX 78731","As a Data Scientist at Indeed your role is to follow the data. We are looking for a mixture between a statistician, scientist, machine learning expert and...",Data Scientist
http://www.indeed.com/cmp/Novetta,Novetta,http://www.indeed.com/pagead/clk?mo=r&ad=-6NYlbfkN0DZbghDog6eAFViHltrtimeH7IE6OveQ-GQud_7SkddKZ31ufd3YNXn3pfpzCV9ckU8aF4FXEMdNMMuriPqwkORncW9ijpAUQMteJKA5qO_YPdZyJ6yQp__XO5UMaH6318gaUwG-w8bOd8Y2RsOBx_RHdxyramlL5ZFHsa17xbAe1rcvzPqDpsP87FbjRkUaydwrtg2uU81Y-llz3PLQIrAZz20dWBdmF4im7MlpLPfpMtWvlMOmPCZ4ZgpFu5teBNNQveUvGnKjRHVgKHxebUrKf_YjFZuADtkl5u3pdD7_Rn6GMp4Zf6f0iaaaJWRRWGRmzV0M8wmHz1Rs4M5-vhReWgpgAUW6e8WbGBxg2zXIKkJ5i3Fk6RmRoi-_GpAS6LCcaCR38whxFRsN1MZr6yPdsn8qwRl3a0dSliU6bkm7nqXnaXP8DSgmNqmdqBxSpvTWdRex53HbkZdb81NbBc7NQVKfIIEvmQ21IgOeK5d-BMWFnkgrJVckN2WdFxzfeG5GQEMTwOIcCaK0M8X9nuwRspeFyJ4sZquH2Wmj7N_1pW_4pFnS2iVOsU3VW5X2jxTE2E-Hk9JUwFG7eAmH2RKVivfZTVmV9v71kIQKmkrE8lr-goQnIPUBd1M_JjQDAC1Kugvm3OHBVLCD3KmkxyKlyvZ9B2c8S6YwQi1zQFZ23mhdFniaHnjafNsS04IRBwtvn7QXoiHgOikL6Tp-8xubCaJC0EK7w59Ajew6M-uNILre4_31pM9Bt2Emej-brSO4uV77DjhpjdQWdgtxEgqkytZ8_V3V_ZEfGLFzcYYiHGrQuh_WSXH4M-lsHZsYlXBov_6Ra2k8mhpc46fx8V9&p=5&sk=&fvj=0,"Crystal City, VA","Experience applying data mining and machine learning techniques in a professional context. Knowledge of data mining and machine learning algorithms, theories,...",Data Scientist
,RS Energy Group,http://www.indeed.com/pagead/clk?mo=r&ad=-6NYlbfkN0AH4CKTkdT7E9kgGwiXtXtW04LsQVpZIo66s4kKwqvZTs19CBU-WfuablWFA-ZRFrlupi55B-j6m7nyTCH8RGDG80ArvTQlgPWVEK66fO4m5yrXI147eteX_rz9xEtjLzbPOdCWLu9z3nqT-BxQUrhiWjK53GH3dx9G64CcOaVDLGvBWCZS_nY8OTalyxYJoBpFdN1ZBOhKc3HWofpqBt6VYhTlAvL3_u9ohXR5Pj97FsJjVoE7ima_AnfJD0fddog-0rpzyB-aWmwSHXxsgSzGkwh6XR_anF6YZkXWQ_WK7rK1XWvuldP2r6Hb5CfaBSxaK54iCxvkveSHJzUse06U7AJmkTGrw1DFq4csHVogbHHfhRCsBBGnMxoVVKGn6n2YWGh8YpiYW7ClRvpifoSCCcdbp_2z2conz3hXe6eIIOjfb8KnTutW&p=1&sk=&fvj=1,"Plymouth Meeting, PA",Working alongside Data Scientists to productionalize advanced computer science algorithms like machine learning and natural language processing....,Data Engineer/Scientist
,"Syntelli Solutions, Inc",http://www.indeed.com/pagead/clk?mo=r&ad=-6NYlbfkN0Dqrr-Rjg2XLksGNbp1zr5zrpCZUmaYUPA5zQ_vrCj_X6a_99tNJpNpXW6b2-NnzR-s72LGlIrkkvWFRwr2frmiwkGfTVc8Qgg6uKo4D4z8Hcb6niEHqdp_J0Q9g6aYSoYTmug_FVffV-BytzsyRywapYtRxTJL6iKYE81eAClXL6TGeheHp5KAl_rLWemt4f_hQuMI22X0g2KsP3KM3L6unB1WAUWozKlA0ZwENQpM0tdgWAcw8iALSaxIaw_N4ARxn_jkGXFQIWKTMVQvF_O_r5CJAMZilQTgvWftztq_PFCvtkq6waDgA9AlxHuhjGj1ngZ5cYuyamcQIeSUldyR-lk1yeZqU0PizHAO3B3JO5dVQf2rJ1s5Hl7LSnvtsxRnBHsjPPSD34uS1ZmdejzaXa9v-aT3GUHdzzFhaTBwgg==&p=2&sk=&fvj=1,"Charlotte, NC 28277",Senior/Lead Data Scientist:. 2+ years as Senior/Lead Data Scientist. Lead role in our very fast growing Data Science team from marketing analytics perspective....,Data Scientist
,Penfield Search Partners,http://www.indeed.com/rc/clk?jk=4e9f987f7fe656f7&fccid=5d807087f2960e47,"Philadelphia, PA","They are now seeking several Biostatisticians at varying levels to provide statistical, clinical data management and programming support....",Senior Statistician to Associate Director Biostatistics
"http://www.indeed.com/cmp/University-of-Nevada,-Reno","University of Nevada, Reno",http://www.indeed.com/rc/clk?jk=58d8aa32be66cb0b&fccid=5669dd56ea8222e6,"Reno, NV",Large scale storage systems Parallel file systems High speed interconnects Experience communicating with research scientists and engineers Experience in a...,"Assistant / Application Specialist / Senior Application Specialist, High Performance Computing"
http://www.indeed.com/cmp/Digital-Staffing,Digital Staffing,http://www.indeed.com/rc/clk?jk=5f201fc4bba61fd1&fccid=cc09e00f6bf8b44d,"Hoffman Estates, IL 60179","Your strong mechanical/ electrical aptitude and machine shop experience can open new opportunities for you to learn and grow professionally with a busy,...",Motor Repair Technician *** Up To $20/Hour *** Great Learning Opportunity with High Activity Machine Shop!
http://www.indeed.com/cmp/Adobe,Adobe,http://www.indeed.com/rc/clk?jk=d0972c8df27d81f4&fccid=f89deb5a97c7738a,"San Jose, CA","The Systems Technologies Lab is part of Adobe Research - a team of world-class researchers in machine learning, data mining, econometrics and social networking....",Data Scientist
,Celmatix,http://www.indeed.com/rc/clk?jk=a3242631dffb3112&fccid=ef4ef175212ffb1e,"New York, NY 10005 (Financial District area)",We seek a Data Scientist with deep expertise working with large clinical datasets to join our growing scientific team....,Data Scientist
http://www.indeed.com/cmp/IBM,IBM,http://www.indeed.com/rc/clk?jk=1326ee6ee9ca33c6&fccid=de71a49b535e21cb,United States,"Automatically find and interpret data rich sources, merge data together, ensure data consistency, and provide insights as a service....",Data Engineer / Data Scientist
http://www.indeed.com/cmp/Koch-Industries-Inc,KOCH INDUSTRIES INC,http://www.indeed.com/rc/clk?jk=523c2a1dbf8cd3de&fccid=3b3de35679d776d8,"Arlington, VA 22201 (Lyon Village area)",The Data Scientist will discover actionable insights using a large repository of individual-level data. Theoretical knowledge and extensive experience with...,Data Scientist (i360)
http://www.indeed.com/cmp/Zillow,Zillow,http://www.indeed.com/rc/clk?jk=030ec8a866aa2c65&fccid=913e1b259c8d65e2,"Seattle, WA 98101 (Downtown area)",Zillow Group Business Analytics team is looking for a Data Scientist interested in transforming ideas into action....,Data Scientist- Business Analytics
http://www.indeed.com/cmp/Aetna,Aetna,http://www.indeed.com/rc/clk?jk=2a80b9765062dcd3&fccid=7077d7e88049c02a,"Wellesley, MA","Demonstrates proficiency in several areas of data modeling, machine learning algorithms, statistical analysis, data *....",Sr Data Scientist
http://www.indeed.com/cmp/The-University-of-Iowa,The University of Iowa,http://www.indeed.com/rc/clk?jk=f1db4682bdd77f32&fccid=fa9286d53c8ca6e7,"Iowa City, IA 52242","Promote the University's research mission by supporting scientific, scholarly and creative activities through scientific inquiry, open discovery, dissemination...",ASST RESEARCH SCIENTIST/ENGIN
