company_link,company_name,job_link,job_location,job_summary,job_title
,TechStratium Inc.,http://www.indeed.com/company/TechStratium-Inc./jobs/Data-Scientist-aa9e304fdf37e89b?fccid=2da405d7f4573621,"Baltimore, MD","Experience with data visualization of insights gained from complex data set analysis. TechStratium is hiring Data Scientists to join our team in Baltimore, MD....",Data Scientist
http://www.indeed.com/cmp/Akamai-Technologies,Akamai,http://www.indeed.com/rc/clk?jk=af5d288afac40e48&fccid=9c094dedde5fb497,"Santa Clara, CA","Masters or higher degree in applied math, statistics, machine learning, computer science or relevant subject....",Data Scientist..
http://www.indeed.com/cmp/SAS-Institute,SAS Institute,http://www.indeed.com/rc/clk?jk=ea7f95b2729e4df4&fccid=068cc3667458485a,"Cary, NC","We work closely with deep learning scientists, cognitive computing experts and computational linguists to supporting over 30 languages around the globe....",Data Scientist - Speech-to-Text NLP
http://www.indeed.com/cmp/Blackrock-Inc.,BlackRock,http://www.indeed.com/rc/clk?jk=e4ae3d5a0b7c9106&fccid=58c732f14833248a,"New York, NY 10001 (Chelsea area)","We are looking for a data scientist with advanced skills in mathematics, technology and data mining to help build algorithms that leverage large quantities of...",People Analytics & Research Data Scientist
http://www.indeed.com/cmp/Mylan,Mylan,http://www.indeed.com/rc/clk?jk=a7a674d907efbde1&fccid=38c6ffdbaba2dc01,"Morgantown, WV","Support initiatives including programming in the area of clinical data management and statistical analysis. By doing so, we will continue to set new standards...","Intern, Statistical Programmer"
http://www.indeed.com/cmp/Lawrence-Livermore-National-Laboratory,Lawrence Livermore National Laboratory,http://www.indeed.com/rc/clk?jk=50b0f06c1b184ae4&fccid=26727f1861532c63,"Livermore, CA 94550","We have multiple openings for Engineers, Computer Scientists, Data Engineers, Applied Statisticians, or Applied Mathematicians....",Machine Learning Engineer
http://www.indeed.com/cmp/University-of-Dayton,University of Dayton,http://www.indeed.com/rc/clk?jk=c6f8f671ca4c78b3&fccid=f2c4f34c75d0143a,"Dayton, OH","Experience with Machine Learning, Neural Networks, Data Mining techniques. Bachelors in a relevant discipline plus a minimum of eight (8) years equivalent...",Senior Data Scientist
http://www.indeed.com/cmp/Altair-Engineering,Altair Engineering,http://www.indeed.com/company/Altair-Engineering/jobs/Statistical-Business-Analyst-f1276f4496734854?fccid=3453268f43beb582,"Raymond, OH","Altair ProductDesign is a global, multi-disciplinary product development consultancy of more than 700 designers, engineers, scientists, and creative thinkers....",Statistical Business Analyst
http://www.indeed.com/cmp/Akron-General-Health-System,Akron General Health System,http://www.indeed.com/rc/clk?jk=6a7a660d650a6b51&fccid=2c547debfa7f19ec,"Akron, OH","Under the direct supervision of the Supervisor, Health Information Management, the Clerk, Data Analysis Release of Information (ROI), is responsible for...",Clerk Data Analysis ROI
http://www.indeed.com/cmp/Endeavor,Endeavor,http://www.indeed.com/rc/clk?jk=721d5308a7594720&fccid=f20e613552c29d10,"Louisville, KY","Our Chief Data Scientist will be tasked with representing the scientific goals and interests of Edj Analytics at industry conferences, meetings, conventions and...",Chief Data Scientist
http://www.indeed.com/cmp/Indeed,Indeed,http://www.indeed.com/pagead/clk?mo=r&ad=-6NYlbfkN0CiRNM7CVr8YueLFKlzwbFWI0o7IjV438l4sVrvKZ0fliTfoNv_ONF5FvJKNaJe41O5vUOqHByFV-Kbj5Y3ThgQQObxPdR8ypSHPTD0Fer3x1OFY1fvzVKlLPcdMTrwb68jqlrGSZRldd8bqmPUGuD2lhibEypPUBAtrWpeG6V9-D01XzFqm_GpCmWdC3MMxffJkzyQ-10J5vnAhBTvMh05vK3SS7rOaOmY61pvP8KIx_4mm3y2cM_CY8WxrPDrghSQOdHOY602Eodds-lThbIwIxzyXvFZgggNR5TFU27FcDZHK6tqdh9UFwcMAS5r1-zjwqfEq84nANv5rzN7eZepZw0zH8aCMw71uk8l0T05RvGzMn8H-VHJ_Vj4Vx3UwiVfhiT-ogjM6wUCeQO308Cpj0d4frQSCXRzoEH1TqzDxLVO4IOxnyJVd5dKeTntHpHuyZy_bAfGwSqJDZryGribOJxQpLG2rIbJLPyGDYp-ag==&p=1&sk=&fvj=0,"Austin, TX 78731","As a Data Scientist at Indeed your role is to follow the data. We are looking for a mixture between a statistician, scientist, machine learning expert and...",Data Scientist
,"Syntelli Solutions, Inc",http://www.indeed.com/pagead/clk?mo=r&ad=-6NYlbfkN0Dqrr-Rjg2XLksGNbp1zr5zrpCZUmaYUPA5zQ_vrCj_X6a_99tNJpNpXW6b2-NnzR-s72LGlIrkkvWFRwr2frmiwkGfTVc8Qgg6uKo4D4z8Hcb6niEHqdp_J0Q9g6aYSoYTmug_FVffV-BytzsyRywaNbxmzs3ePxb6_qqE90XLtygUdu3fWLjjSCavYuyASqCSGlakL8uFcgqJqyjsIkx2TB-r6p5KoSoMxAjqcRFlWkQOv81C44n_db9yzWMNgKabXxTWIpyi9xmSub-M8YQipYZQnWdM3KVDE5Zke-dCOVeOPi-qwC638H2DhMQmmNYmp_bo66zVjEtCtlfrLyboARXkgbhS7WRq9rmUfTAp2i32_vnuMl6Ns5PcP7QOBOoOJCodnbIJLCT4oRxaanRwSIvtW8G5NMe7-5sQshA0RQ==&p=2&sk=&fvj=1,"Charlotte, NC 28277",Senior/Lead Data Scientist:. 2+ years as Senior/Lead Data Scientist. Lead role in our very fast growing Data Science team from marketing analytics perspective....,Data Scientist
http://www.indeed.com/cmp/Walmart-Ecommerce,Walmart eCommerce,http://www.indeed.com/pagead/clk?mo=r&ad=-6NYlbfkN0ASqHCEO9GpEUGjkXl8JxXxJB8G4bxm4-V1wqiPq6GTVg0dexUg4LUC1Xvy-Hj3JfvgW6Kn5vqROfEP7DBmdabnwGqVZXSr7gqBOaZltwR5TlPJtKzwqE1-IO0CXhoGzDGP3SoNTUll16uKR-Ip-64nkwk2FTgDYG5GNxdtonZh0lyr5FeF3Qxk463w_Zmp2-t35mmxMgeQEM3jYH59WScidhkrO2T9icif55mT5vC7pEs2v3Yk7vVHsV8S_l8NpTImprmlWY0IOGAkjowsQlLqX-a0rLncJ4QmEGK3GEbLmREmm1VbShXGtYi__FKoetJi2cXCbrLvPSRvKklDBXKyCtGbYpZ0OekwtxM6E3uWCJlrJefFRcZC8xxgKoDup9Y-julu7sexPI5pN4DZ4iST&p=3&sk=&fvj=0,"San Bruno, CA 94066","We employ big data at scale -- from machine learning, data mining and optimization algorithms, to modeling and analyzing massive flows of data from online,...",Data Scientist
,"Syntelli Solutions, Inc",http://www.indeed.com/pagead/clk?mo=r&ad=-6NYlbfkN0Dqrr-Rjg2XLksGNbp1zr5zrpCZUmaYUPA5zQ_vrCj_X6a_99tNJpNpXW6b2-NnzR-s72LGlIrkkvWFRwr2frmiwkGfTVc8Qgg6uKo4D4z8Hcb6niEHqdp_J0Q9g6aYSoYTmug_FVffV-BytzsyRywaNbxmzs3ePxbN1y4r3X2fbH8dJJ4JuPs23tHExKyvmubNf_c0d6lqtP77BFuVfvYhj7JBpZ2CCjXYEn2dhgnrndWasTfc3lWTnugnfhtK9dyc1F1KW0gpnKg56ADf7Zn3e_ImJi5J7Vy249lpBGZIjyf9zHqt8_k2l6OvLAh_wqjJfo-wWdHASgYggDOZJmz21irXk4vh0uvF-0MXEm1_2luDkTMrZ0fYNe1xTRPaRvGBQKNBFzdwoMd0Jhk-kG-V4DWhSR2V6heb-ZdwoVlNjw==&p=1&sk=&fvj=1,"Charlotte, NC 28277",Senior/Lead Data Scientist:. 2+ years as Senior/Lead Data Scientist. Lead role in our very fast growing Data Science team from marketing analytics perspective....,Data Scientist
http://www.indeed.com/cmp/Walmart-Ecommerce,Walmart eCommerce,http://www.indeed.com/pagead/clk?mo=r&ad=-6NYlbfkN0ASqHCEO9GpEUGjkXl8JxXxJB8G4bxm4-V1wqiPq6GTVg0dexUg4LUC1Xvy-Hj3JfvgW6Kn5vqROfEP7DBmdabnwGqVZXSr7gqBOaZltwR5TlPJtKzwqE1-IO0CXhoGzDGP3SoNTUll16uKR-Ip-64nuZl3DGk6oVw-_8_eh4YVCQlBpYWV3eyaG9hXSP6N17fFwAtfjpAtm_JGZPb8MtZzLs2hSSCDDVs14nxvkPKE6F6WvCzn7PFJMXWt6m4bkr0f3VqhWUG66F6c6qAMhbsaI4J_n1YKF6ZO5sZefap1EI3mFlw6wLhmrKOqC1jubCXUFcRo3UPFvEAFD7nyaUsqR42GcQX_-l6o93Tdfk4nWOSlQ5nL5eHMmtyQKSuKCIdxghkphle-X9pMOU0EkKTT&p=2&sk=&fvj=0,"San Bruno, CA 94066","We employ big data at scale -- from machine learning, data mining and optimization algorithms, to modeling and analyzing massive flows of data from online,...",Data Scientist
http://www.indeed.com/cmp/Indeed,Indeed,http://www.indeed.com/pagead/clk?mo=r&ad=-6NYlbfkN0CiRNM7CVr8YueLFKlzwbFWI0o7IjV438l4sVrvKZ0fliTfoNv_ONF5FvJKNaJe41O5vUOqHByFV-Kbj5Y3ThgQQObxPdR8ypSHPTD0Fer3x1OFY1fvzVKlLPcdMTrwb68jqlrGSZRldd8bqmPUGuD27nd82kD7uSxZIr76NUIRzv6jpq0VOgd02Yj7YS7wp6t9__uDwiRG5jeLZcDLTnxnvXOsJwKUDntyJ3UgeuNWD90ar3k8EgyL5o8wpvx8fqyIvA_kpq_jNsmZUDo7KxiylABwVXKEMJFgLrsi9Bg9S5ObECOU6dyxYAcIrVgX4KSrFgn9sHWT_yRp8dt2oqESRuOU8RpdNHUizNwN0WDvW-ucyoRaqQVvPHJUFgdexte2SIo59f7MKC3c_zxt91nylvb4Cn7IOaXDOQIBmAQ3IEsu3R0aV9x5O2To9uZJE0wRXJyAH5iMBZ_MMe7Z34mvglUjsWlTLdMb_ho7w0_ClQ==&p=3&sk=&fvj=0,"Austin, TX 78731","As a Data Scientist at Indeed your role is to follow the data. We are looking for a mixture between a statistician, scientist, machine learning expert and...",Data Scientist
http://www.indeed.com/cmp/Endeavor,Endeavor,http://www.indeed.com/rc/clk?jk=721d5308a7594720&fccid=f20e613552c29d10,"Louisville, KY","Our Chief Data Scientist will be tasked with representing the scientific goals and interests of Edj Analytics at industry conferences, meetings, conventions and...",Chief Data Scientist
"http://www.indeed.com/cmp/Deltek,-Inc.","Deltek, Inc.",http://www.indeed.com/rc/clk?jk=f7cdbd2422b0b71d&fccid=4b1d86bcf0bd79cb,"Herndon, VA",Participate in formal quality assurance reviews to ensure maintained delivery of data quality within the assigned agency related book-of-business....,Research Analyst
,"Logyx, LLC","http://www.indeed.com/company/Logyx,-LLC/jobs/F-T-Senior-Computer-Scientist-Sw-Engineer-Open-Data-Open-Science-Genelab-Omic-20c49625f3ef1d71?fccid=c048e307431165b2","Mountain View, CA 94043",The goal of this project is to build a data system on top of open sourced bioinformatics software platform for researchers to access and use biologically...,F/T Sr Computer Scientist/SW Eng Open Data/Open Science Genelab Omics
http://www.indeed.com/cmp/Turner,Turner,http://www.indeed.com/rc/clk?jk=492a3283c3c9a359&fccid=92b6ad9b1bd886b6,"Atlanta, GA 30319",Has proficiency in and routinely uses analytics software applications such as Adobe Reports & Analytics (Omniture)....,"Analyst, Research"
http://www.indeed.com/cmp/Orau/orise,Oak Ridge Associated Universities,http://www.indeed.com/rc/clk?jk=f9f113d6c4dd9bc0&fccid=9ee66ada40315e6d,"Atlanta, GA",Experience analyzing data using R and SAS is required. Analyzing data sets including but not limited to the National Health and Nutrition Examination Survey...,STD Statistical Analysis Fellowship -- CDC
http://www.indeed.com/cmp/Market-Track,Market Track,http://www.indeed.com/rc/clk?jk=d6157d1d92fa51fb&fccid=b1ffcc30addac76d,"Solon, OH 44139","Today more than 1,700 clients, including 75 of the nation's top 100 advertisers, as well as global Fortune 500 retailers, manufacturers, and brands depend on...",Entry-Level Market Research Analyst
http://www.indeed.com/cmp/Stony-Brook-University,Stony Brook University,http://www.indeed.com/rc/clk?jk=1fde2cf85df0fdeb&fccid=f0403976aaff461d,"Stony Brook, NY","It encompasses Stony Brook University Hospital, Stony Brook Children’s Hospital, the five Health Sciences schools — Dental Medicine, Health Technology and...",Research Analyst
http://www.indeed.com/cmp/Northrop-Grumman,Northrop Grumman,http://www.indeed.com/rc/clk?jk=151081978118089c&fccid=11619ce0d3c2c733,"Monterey, CA",Northrop Grumman Corporation is looking for a Data Insights Analyst to work with a team of researchers using large administrative data assets for studies of...,Behavioral Res Scientist 2
http://www.indeed.com/cmp/Boeing,BOEING,http://www.indeed.com/rc/clk?jk=69924cfba1264ede&fccid=edae4285faf6c2f0,"Springfield, VA","Skilled scientists and thinkers. A technical degree is defined as any four year degree, or greater, in a mathematic, scientific or information technology field...",Spacecraft Engineer (Level-2) - Support Analyst
http://www.indeed.com/cmp/Northwestern-University,Northwestern University,http://www.indeed.com/rc/clk?jk=9d09dec22b5a9c90&fccid=bc51f56762438d6f,"Evanston, IL",Excellent data visualization ability required. Designs and prepares documentation for data management and/or data analyses....,Research Data Analyst Lead
,RS Energy Group,http://www.indeed.com/pagead/clk?mo=r&ad=-6NYlbfkN0AH4CKTkdT7E9kgGwiXtXtW04LsQVpZIo66s4kKwqvZTs19CBU-WfuablWFA-ZRFrlupi55B-j6m7nyTCH8RGDG80ArvTQlgPWVEK66fO4m5yrXI147eteX_rz9xEtjLzbPOdCWLu9z3nqT-BxQUrhieSNbotpNK4Qfsb-SSBQ2_6CiByfTYEbTCXpqSbc9D0cz57nesVLKTE5XNBRHLkyfTRuCSZVqK0JhlbavzZB2DZpEGt_p1K5f2_rmW8yS3EURQXldnLeEl2tHdx1IukGw8mKSGKeEkjhamhLRHlQrol_0pK8JR4nM6ZUI3JDSHa0hGMBAMMHIq_jRDO7PXEyJTHhBKoZM3FUW69es-kRg9sTtVBDdAhr2NK82lV7D9op79p-gcektwrF3KMxQDQG2E8kUE4f2sVXqJzN8wd4Tta9da6-217d-&p=4&sk=&fvj=1,"Plymouth Meeting, PA",Working alongside Data Scientists to productionalize advanced computer science algorithms like machine learning and natural language processing....,Data Engineer/Scientist
http://www.indeed.com/cmp/Novetta,Novetta,http://www.indeed.com/pagead/clk?mo=r&ad=-6NYlbfkN0DZbghDog6eAFViHltrtimeH7IE6OveQ-GQud_7SkddKZ31ufd3YNXn3pfpzCV9ckU8aF4FXEMdNMMuriPqwkORncW9ijpAUQMteJKA5qO_YPdZyJ6yQp__XO5UMaH6318gaUwG-w8bOd8Y2RsOBx_ROqolEOR29gCIZ02OwbtbezAM44rgnzTOozt--Nj-tS1bG70-xon5jkyh4UVVtJD2pq10bSYbV92A3mBig6tVV1OnAze3flocKFSayrRZuuhdC3h35RqAyDJ8MN3JRsz9AYF1jFpT7XAxHY_FG6LvVHsFvVeiR2Gb_XTo8qw4JhUF5mJ7hSwvDqMhfKmYccYtn46vTb37JXmRsLuIx4FLBYIzrBW5uRjCVPRBNF_DUATfD4INcCwlFW_Dro9Qg0bZopfbyftu-nNwI7zqtvc7IkRJ8w9Gr9pPEiCFyPt1Q34R_Y9d04xitK5_X_nOF6LnC5pP8QniLJqm6AhHqaB4npeSS3LehH6U9iKZlZUIU3U4pOPWEklpnLhOUJNwH_qyqlMklN7bW73v4Qq4_LjQAS0F4RDNYtovuudxL4q2VvwTrEMXTSlaPlyAiaUm820Kj7HO4QIltnHOToxAwZ0nyowWKaSRl3SiLcAWAHrx4o7kpWz3nobVF21rj-SIP_4K1ssY0nhqAHL7EhCCMYXX9FIqfiHfyxD2RVooQcAZbFqTn5igX3ObW-wZGIKlkgmo6hAKh4IWdKdCBQDidbd3XRi0_reUi1CSwdJ80x7XKFmlBXUlkNlmwO-TNqazuIm__vW-rO0K47PSJ8bJomh5TjQl0V8JVVnm7iASBb_oYz6ePqme_ndRgMcM9DhlOVdd&p=5&sk=&fvj=0,"Crystal City, VA","Experience applying data mining and machine learning techniques in a professional context. Knowledge of data mining and machine learning algorithms, theories,...",Data Scientist
,RS Energy Group,http://www.indeed.com/pagead/clk?mo=r&ad=-6NYlbfkN0AH4CKTkdT7E9kgGwiXtXtW04LsQVpZIo66s4kKwqvZTs19CBU-WfuablWFA-ZRFrlupi55B-j6m7nyTCH8RGDG80ArvTQlgPWVEK66fO4m5yrXI147eteX_rz9xEtjLzbPOdCWLu9z3nqT-BxQUrhimnceMDiTSWY3q-n_8q_47xh81ygqpJJplJBap46_lFO0oQ78IAcz81VIfWMhnPLdLHNgH9oxT5bYqXC-uUPfKJpnvvZ3Cq7dLAvZ0b1DRzERmRsek0O4h8ugGw87foYMA48J7lPA33rEFgl1x-NnwPaPyhXdqRRXK2dYxw-aF4wuNozg7K6YVzRlNicT2NMHYhqyJBA1AUgUbYGcZqO7BSkaY_CIA4w84DyAws5kfjvb6exbPJc4Sm_Iprzig_vRtvkbV33Dz63kuVDXP6iCBBe_HvLvoR05&p=1&sk=&fvj=1,"Plymouth Meeting, PA",Working alongside Data Scientists to productionalize advanced computer science algorithms like machine learning and natural language processing....,Data Engineer/Scientist
,"Syntelli Solutions, Inc",http://www.indeed.com/pagead/clk?mo=r&ad=-6NYlbfkN0Dqrr-Rjg2XLksGNbp1zr5zrpCZUmaYUPA5zQ_vrCj_X6a_99tNJpNpXW6b2-NnzR-s72LGlIrkkvWFRwr2frmiwkGfTVc8Qgg6uKo4D4z8Hcb6niEHqdp_J0Q9g6aYSoYTmug_FVffV-BytzsyRywawwxzDfKJW17ioWgutdGwHDq1POy2Hmizim7tLRvGV55LdSpSrBbKsFezEShXFbT5T39CchkfsY_angCOVj_aXnmhlT7yU0OC-Zmn-rXF81RguxO7IpTJ4Tzn8eRppkqMKWgucWlSQiNBQewm2N7m7uYrcE9K2PONsVF6wx57NXlaLWMhh71G7w4e7MBc2HnhDKG-pbHh1Cg7iLW28ytNwZiw-5kvMykKyDRZ3Ryp8wDELgV0m91ivJwxxurhVnrJ_i4AZcoLhkCEojW9xCBYLA==&p=2&sk=&fvj=1,"Charlotte, NC 28277",Senior/Lead Data Scientist:. 2+ years as Senior/Lead Data Scientist. Lead role in our very fast growing Data Science team from marketing analytics perspective....,Data Scientist
http://www.indeed.com/cmp/Walmart-Ecommerce,Walmart eCommerce,http://www.indeed.com/pagead/clk?mo=r&ad=-6NYlbfkN0ASqHCEO9GpEUGjkXl8JxXxJB8G4bxm4-V1wqiPq6GTVg0dexUg4LUC1Xvy-Hj3JfvgW6Kn5vqROfEP7DBmdabnwGqVZXSr7gqBOaZltwR5TlPJtKzwqE1-IO0CXhoGzDGP3SoNTUll16uKR-Ip-64nUQUnmKsI00a56n7zi88qllqPxDgqUF5VxDhVs3abW5dzFpnE5g9O1jVvU_ReI-hQndrjJv4jvWRwTi32H0aLnGnze7r9Ro9jWecWl1k8NfID7sIF1-_cILorARY9lYmxeUZOhPqBLbvZyXeCp_lWLLTsvh2rV7bT5LhTQIVNy1URf0m4kv2EVAL-bwU7KsJ8vKxOprWXKjt0pjO6G5tI1LOqZpu6oWh8gG-UxcK9zmgfjmGwdulfa7Pp0e-9x90y&p=3&sk=&fvj=0,"San Bruno, CA 94066","We employ big data at scale -- from machine learning, data mining and optimization algorithms, to modeling and analyzing massive flows of data from online,...",Data Scientist
http://www.indeed.com/cmp/Liberty-Mutual,Liberty Mutual,http://www.indeed.com/rc/clk?jk=afc5092550209a73&fccid=bba15db4d8763697,"Boston, MA",You will also support these data scientists in manual scoring of data for some deployed complex models. There is also the opportunity to learn to build simple...,Sr. Analyst- Advanced Analytics
http://www.indeed.com/cmp/Boeing,BOEING,http://www.indeed.com/rc/clk?jk=7bd1d768f21be939&fccid=edae4285faf6c2f0,"Titusville, FL 32780","Skilled scientists and thinkers. Serial Data over Ethernet. Network engineering (voice, data and video). Quintron Voice (DICES) and Data Multiplexer devices....",Systems Communication Engineer - Entry Level
http://www.indeed.com/cmp/Darwin-Recruitment,Darwin Recruitment,http://www.indeed.com/rc/clk?jk=9b02da492c3b9f7a&fccid=2492b919e00491c0,"Boston, MA","Apply machine learning, NLP and deep learning methods to huge data sets. Natural language processing, machine learning, machine vision, collaborative filtering,...",Machine Learning Engineer
http://www.indeed.com/cmp/Incyte-Corporation,Incyte Corporation,http://www.indeed.com/rc/clk?jk=c51f4641de6155dd&fccid=cfc58edd05df8372,"Wilmington, DE 19803","In collaboration with academic, clinical and industrial scientists, this group utilizes the knowledge that has been developed around each of our existing...",Program Leader to VP (DOE) - Leukemias
http://www.indeed.com/cmp/Incyte-Corporation,Incyte Corporation,http://www.indeed.com/rc/clk?jk=cede2ccc5646dfaf&fccid=cfc58edd05df8372,"Wilmington, DE 19803","In collaboration with academic, clinical and industrial scientists, this group utilizes the knowledge that has been developed around each of our existing...",Program Leader to VP (DOE) - Lymphomas
http://www.indeed.com/cmp/Novetta,Novetta,http://www.indeed.com/rc/clk?jk=273a1b6d9d5de691&fccid=1d69e9a5b2cfbeca,"Reston, VA","Experience working with data analytics and machine learning algorithms (e.g., using R, NumPy, or MLib). Machine Algorithm Developer....",Machine Learning Algorithm Developer
http://www.indeed.com/cmp/The-Dow-Chemical-Company,The Dow Chemical Company,http://www.indeed.com/rc/clk?jk=4b0bb3c1edd1c45a&fccid=5e232844f622d780,"Indianapolis, IN","Serve as Subject Matter Expert (SME) or project leader on large multi-disciplinary project teams to collaborate, provide technical input and deliver results...","Research Scientist, Biochemistry"
http://www.indeed.com/cmp/Boeing,BOEING,http://www.indeed.com/rc/clk?jk=733a8f3bb226da46&fccid=edae4285faf6c2f0,"Cape Canaveral, FL","Skilled scientists and thinkers. Bachelor, Master or Doctorate of Science degree from an accredited course of study, in engineering, computer science,...",Software Engineer Entry Level
"http://www.indeed.com/cmp/Deltek,-Inc.","Deltek, Inc.",http://www.indeed.com/rc/clk?jk=12d93c94df2a21cf&fccid=4b1d86bcf0bd79cb,"Herndon, VA","Experience in marketing, customer support, data collection, business development or public sector. Organize, analyze, and synthesize data and information using...",Assoc Research Analyst
http://www.indeed.com/cmp/M&T-Bank,M&T Bank,http://www.indeed.com/rc/clk?jk=91b0c1f38ea7a540&fccid=0e36880b18d20c75,"Buffalo, NY","Bachelor degree in Mathematics, Statistics, Quantitative Analysis or another technical discipline with minimum of 2 years relevant experience or in lieu of...",Quantitative Risk Analyst I
http://www.indeed.com/cmp/Indeed,Indeed,http://www.indeed.com/pagead/clk?mo=r&ad=-6NYlbfkN0CiRNM7CVr8YueLFKlzwbFWI0o7IjV438l4sVrvKZ0fliTfoNv_ONF5FvJKNaJe41O5vUOqHByFV-Kbj5Y3ThgQQObxPdR8ypSHPTD0Fer3x1OFY1fvzVKlLPcdMTrwb68jqlrGSZRldd8bqmPUGuD28jMPl1KeHQzNcBQm5fmRgO8AJFdkcYwoaXcCVWP-0275PozrQS7120IjBgVmSHYnbQ_1fi2pP1KY9Kjdf-jdZHMELiX_kMqULPHrW4w1ut_MmW4pNgS-IQtsh2ibqq_E8UHnlrziTbkOQOrzUziS4nnULpDQ3XHMwq3y4MS0sbxcuxicPQV_uhfI30skOUAiqpwXE5P_sGiY0RhINk66v0DTrO0QLFcdnE1fwEr926tA__mLAp_8zY-0AIZe6G5XIidAo1CCUDa4in7TNfz9fuKYVrd7l9CHaLwS-97J-ngQWdS6eZ7CO6k2KKqQQRRlebNwZJmSwts0QgxfgL_GLQ==&p=4&sk=&fvj=0,"Austin, TX 78731","As a Data Scientist at Indeed your role is to follow the data. We are looking for a mixture between a statistician, scientist, machine learning expert and...",Data Scientist
http://www.indeed.com/cmp/Novetta,Novetta,http://www.indeed.com/pagead/clk?mo=r&ad=-6NYlbfkN0DZbghDog6eAFViHltrtimeH7IE6OveQ-GQud_7SkddKZ31ufd3YNXn3pfpzCV9ckU8aF4FXEMdNMMuriPqwkORncW9ijpAUQMteJKA5qO_YPdZyJ6yQp__XO5UMaH6318gaUwG-w8bOd8Y2RsOBx_R0ZvW6dlcXBR3xYTjUlAjTDjp3sU5YWKkGUaduY69fjgWi7h1FzrCMpqAc9pRv0iPjz-4b6YoWqEqEGcRpjC9gx7qCH7rYzXAnOtQTcZOKudcjUx-oGXKleg69vz_P4uS5J4irus23tENaH2btEieoggjHtNgzoEoc1y6i9jKrFy-8Ql7Vpsamf7GBawLPwDySp86OoerloSMuxaqUqADMc7cxWOyN_tykNGAIav7kcsW-3ZSmfF6Xp3CbpcWqdHsVeC1dR4EXOir4x7L7dKW8pJzqg2xdap_nzqRPaIrJF2TaNAWKGiSPPsdaTCkuf4zyq-l5ZX06hjaO_qFqmyI102PqpYH7LWuvGntjPRjOQxBa2jUaAQUoSD4Vg1CptobRz3qOdYZ2zoqLpQMEiHO7bli5gK5qRTNjlksLQi1Dq9QjkmqDtyj3s61GSCavzpSiGGpx9c_z3ApiDr34NuXQ7LTqj-cfiRRG5rFL2YyoknT4bRpX5a1OJAbaooKC4IrsCGLDP6ykfVgOyANYnrkO-3tOSBzgU1RzgCXlixeaRBrP9C0nwaSf9MDzc8Sf0iI7cyuYBe2SaPA0-wIb5lSpkKGflSZPOJb_5AiXFKEjX1bBuz7Pe1pya5_VbNB2SUYKXYB7K34WdHDMyBYdHjenTjmjb_MeRu0y2carHxcKj9SHQ5oLWEQEGQ30JhwN73G&p=5&sk=&fvj=0,"Crystal City, VA","Experience applying data mining and machine learning techniques in a professional context. Knowledge of data mining and machine learning algorithms, theories,...",Data Scientist
,"Syntelli Solutions, Inc",http://www.indeed.com/pagead/clk?mo=r&ad=-6NYlbfkN0Dqrr-Rjg2XLksGNbp1zr5zrpCZUmaYUPA5zQ_vrCj_X6a_99tNJpNpXW6b2-NnzR-s72LGlIrkkvWFRwr2frmiwkGfTVc8Qgg6uKo4D4z8Hcb6niEHqdp_J0Q9g6aYSoYTmug_FVffV-BytzsyRywawwxzDfKJW16ONaDtnn8Qeq5JF_KmtuQ-euiV765AvBjTPf_-BdV2FhrBuF1MZpwRb2GzvpFLtEcytVIDHH4x1pDZ7ZKSyTbClROysyfUFisjOGwxcK__npXO_jS9vlIzwmVGM16wn43L6h82wlF6TNLpsO9AfwN5Fml03iO7jEZkwYjD31KBr15Q9IHpvZN2VHS4whDtZuAD3iE-Cj0Qyx8rAHygzQoj8ryz09gMryL9j7Ok4NfP8dTMeJcuRbyF-2NjibiSZ6xw0mYAsYNwJg==&p=1&sk=&fvj=1,"Charlotte, NC 28277",Senior/Lead Data Scientist:. 2+ years as Senior/Lead Data Scientist. Lead role in our very fast growing Data Science team from marketing analytics perspective....,Data Scientist
http://www.indeed.com/cmp/Walmart-Ecommerce,Walmart eCommerce,http://www.indeed.com/pagead/clk?mo=r&ad=-6NYlbfkN0ASqHCEO9GpEUGjkXl8JxXxJB8G4bxm4-V1wqiPq6GTVg0dexUg4LUC1Xvy-Hj3JfvgW6Kn5vqROfEP7DBmdabnwGqVZXSr7gqBOaZltwR5TlPJtKzwqE1-IO0CXhoGzDGP3SoNTUll16uKR-Ip-64noj2F2tEEUZzhgevZhGQawpsVKC0b4NgaoeI5gmRc85Atd3j3PYHCXKTwTvmmEX3bDaoWc2EKqwNKJxnOucg0N7HVDfqE30AmmhcRD1epOWqFyKM3gyh2aZ94UP7UKr1uF3oh2ONCgupvP_dUGlNmYGTLRG-LDEyGNSP8RMucg_c602mcX82apBTXH-aAYvIR9yIxm5iyVPoEywxc3XhyNMwX6SPrtru58hWQVmDYYLDcm6GfEaRyeVEfWvqQt3h-&p=2&sk=&fvj=0,"San Bruno, CA 94066","We employ big data at scale -- from machine learning, data mining and optimization algorithms, to modeling and analyzing massive flows of data from online,...",Data Scientist
http://www.indeed.com/cmp/Indeed,Indeed,http://www.indeed.com/pagead/clk?mo=r&ad=-6NYlbfkN0CiRNM7CVr8YueLFKlzwbFWI0o7IjV438l4sVrvKZ0fliTfoNv_ONF5FvJKNaJe41O5vUOqHByFV-Kbj5Y3ThgQQObxPdR8ypSHPTD0Fer3x1OFY1fvzVKlLPcdMTrwb68jqlrGSZRldd8bqmPUGuD2jEzoi8S3T2tN1Glf2vxrk0_K1IjzMaPEnoBqzlKzXhoWEHHDhGgPREu6J4_q7RzRc87dh-rUvQwf22I_KSb9mMgcMY5hiMPDRIG5XOJST9RqJMaQqFke9Ro9_ZjDkXVAwIC1JDmOU1mf-5A-Cr145au5PXNhpV7VVa-IqVCywZjMVT-bQlC8O59PXRtHGh-76U5udlYH58LXWgpTDxa7GVvW9P4lc6x7yRH4KyY8xgjj9G9PS66EL0Zio4LlFRDC5Cy121EPiTROgzSKYDHaDnJj0FcVu7tSsF8ITRGcfzZREM_jRSHP5ajEQBOsilmgUMtNaUVygShiwWCK1SiGzg==&p=3&sk=&fvj=0,"Austin, TX 78731","As a Data Scientist at Indeed your role is to follow the data. We are looking for a mixture between a statistician, scientist, machine learning expert and...",Data Scientist
http://www.indeed.com/cmp/Pfizer-Inc.,Pfizer Inc.,http://www.indeed.com/company/Pfizer-Inc./jobs/Scientist-Immunogenicity-02f0a2d04c1b0b93?fccid=5e118f74384e090a,"Andover, MA",The successful candidate will closely work together with the immunogenicity scientists and quantitative protein mass spectrometrists to establish the utility of...,Scientist Immunogenicity
http://www.indeed.com/cmp/University-of-SAN-Diego,University of San Diego,http://www.indeed.com/rc/clk?jk=343e553c90e16b1b&fccid=bdd8aa1427fa6dac,"San Diego, CA","Demonstrated ability to conceptualize and develop proactive prospecting methodologies to support organizational goals, including data mining, sophisticated...",Research Analyst
,Northbound LLC,http://www.indeed.com/company/Northbound-LLC/jobs/Informatic-Scientist-e9c5aabed029e568?fccid=f60f0f1edb9350c6,"New Haven, CT 06511 (Newhallville area)",A comprehensive understanding of data mining and visualization. Work directly with lab scientists to understand the requirements for data analysis and help to...,Informatics Scientist
http://www.indeed.com/cmp/Varen-Technologies,Varen Technologies,http://www.indeed.com/rc/clk?jk=563dfb69eacafcf9&fccid=898cb537778fecc3,"Fort Meade, MD","Data mining, statistical analysis, and mathematical models) to improve analytic tradecraft. Military Health Programs....",Mid-Level Operations Research Analyst
http://www.indeed.com/cmp/SAS-Institute,SAS Institute,http://www.indeed.com/rc/clk?jk=50a71a83af50fd2e&fccid=068cc3667458485a,"Cary, NC","Preferences Experience with open source speech recognition packages such as Kaldi, Sphinx, and HTK Understand language model, n-grams and finite state machines...",Text Analytics Developer
"http://www.indeed.com/cmp/Anthem,-Inc.","Anthem, Inc.",http://www.indeed.com/rc/clk?jk=ca5a01141fe42373&fccid=2a4da7fa99f4b9ae,"Chicago, IL 60654 (Loop area)","DATA SCIENTIST LEAD-Visualization. Requires MA/MS in Statistics, Computer Science, Mathematics, Machine Learning, Econometrics, Physics, Biostatistics or...",Data Scientists Lead - Visualization
http://www.indeed.com/cmp/University-of-Washington,University of Washington,http://www.indeed.com/rc/clk?jk=85637c14c93f3e86&fccid=142783ac2edbe56b,"Seattle, WA","Experience in management, analysis and interpretation of large and complex scientific data sets. The specific projects generating the data change from time to...",RESEARCH SCIENTIST/ENGINEER 4
http://www.indeed.com/cmp/Altair-Engineering,Altair Engineering,http://www.indeed.com/company/Altair-Engineering/jobs/Pwr-Converter-Test-Technician-80b5f25cfedbbf17?fccid=3453268f43beb582,"Vail, AZ 85641","Altair ProductDesign is a global, multi-disciplinary product development consultancy of more than 700 designers, engineers, scientists, and creative thinkers....",Pwr Converter Test Technician
