company_link,company_name,job_link,job_location,job_summary,job_title
http://www.indeed.com/cmp/Sdl,SDL,http://www.indeed.com/rc/clk?jk=00ba0a06de376987&fccid=1d7aed1757bee35b,"Los Angeles, CA","Design, implement and evaluate models and software prototypes for machine learning problems with a focus on natural language processing and machine translation....",Research Scientist
http://www.indeed.com/cmp/Spacecurve,SpaceCurve,http://www.indeed.com/rc/clk?jk=1f8c94b62460e50a&fccid=642127b94898142b,"Seattle, WA","Lead Data Scientist. Broad exposure to data analysis in multiple contexts with deep expertise in at least one. To be considered for our Lead Data Scientist, you...",Principal Data Scientist
,Robo Industries Inc,http://www.indeed.com/company/Robo-Industries-Inc/jobs/Machine-Learning-Engineer-3510d69a999cc039?fccid=85842a4933b9ca60,"Houston, TX 77070",Robo is looking for self-motivated talent with strong software and algorithm development skills to develop machine learning algorithms for automatic operating...,Machine Learning Engineer
http://www.indeed.com/cmp/Ppd,PPD,http://www.indeed.com/rc/clk?jk=f22383f3a4bb30b1&fccid=5e93bbb0f296b0b5,"Middleton, WI",Work is performed in a laboratory and/or a clinical environment with exposure to electrical office equipment. Enters data into databases and reports....,Scientist
http://www.indeed.com/cmp/Moody's-Analytics,Moody's Analytics,http://www.indeed.com/rc/clk?jk=8e636d5025ad6df6&fccid=6f368f7940d1e6cd,"San Francisco, CA",Moody’s Analytics (MA) is the leading risk management consulting company and combines deep industry expertise with unique enterprise risk management software...,Asst Dir-Sr Data Scientist
,HigherEducation.com,http://www.indeed.com/rc/clk?jk=4c16d3c5e079710b&fccid=e42b358bd361dfd0,"Houston, TX","Natural Language Processing, Machine Learning, Deep Learning, Recommendation Systems. Bonus points for experience implementing machine learning algos on GPU's...",Full-Stack JavaScript Developer & Data Scientist
,Level Education from Northeastern University,http://www.indeed.com/rc/clk?jk=d84564fe43aab610&fccid=a646d7ce6d93ff79,"Seattle, WA","Our intermediate analytics curriculum takes students through the theoretical underpinnings of data analytics, including probability, statistics, predictive...",Data Analytics Instructor
http://www.indeed.com/cmp/AIG,AIG,http://www.indeed.com/rc/clk?jk=90b633d4c81e3361&fccid=9a92a4bf81326e1e,"New York, NY","Our Investment Analytics group was created in 2010, and functions as the primary resource within AIG’s Investment Management for asset modeling and related...",Quantitative Analyst - Investment Analytics
http://www.indeed.com/cmp/Entegris,Entegris,http://www.indeed.com/rc/clk?jk=cc48b297bab6dc22&fccid=537cd40d1157d889,"Decatur, TX 76234","Assist Research Scientists with ongoing product development activities. As a member of the Technical Development Analytical Lab team, the Scientist will provide...",Scientist
,Orange County Fire Resue Department,http://www.indeed.com/company/Orange-County-Fire-Resue-Department/jobs/Research-Statistician-5d4d6dd988246c21?fccid=3f34cc855d2b6327,"Winter Park, FL","Produces regular analytical and informational reports specific to area of assignment, such as, inmate population trends and incidents, emergency incident...",Research Statistician
http://www.indeed.com/cmp/Walmart-Ecommerce,Walmart eCommerce,http://www.indeed.com/pagead/clk?mo=r&ad=-6NYlbfkN0ASqHCEO9GpEUGjkXl8JxXxJB8G4bxm4-V1wqiPq6GTVg0dexUg4LUC1Xvy-Hj3JfvgW6Kn5vqROfEP7DBmdabnwGqVZXSr7gqBOaZltwR5TlPJtKzwqE1-IO0CXhoGzDGP3SoNTUll16uKR-Ip-64n7rHYYPzE0kA0nAXNc7yUAbywF3-oDHrXDVTcmO1_ymvCj_QxUjh1kGUh29XaAN5QU_W_PaS6RceP2OlTd-AeOAoaHTCJS77V2jZXpuZ7uiK-NmvySIXDqyoJiL1Q2V6EH86xk2JX4wSDXsS7Govk-b-NP023emn-v94Jj2Nz2G9UuGFI5t5u7Kkm3ErGcIOK6o2CGkpT2F3louFzDSsiLrogi7IxIPVNFy8wCui-fKGmrqJuJJyElLBMirg1lT6s&p=4&sk=&fvj=0,"San Bruno, CA 94066","We employ big data at scale -- from machine learning, data mining and optimization algorithms, to modeling and analyzing massive flows of data from online,...",Data Scientist
http://www.indeed.com/cmp/Novetta,Novetta,http://www.indeed.com/pagead/clk?mo=r&ad=-6NYlbfkN0DZbghDog6eAFViHltrtimeH7IE6OveQ-GQud_7SkddKZ31ufd3YNXn3pfpzCV9ckU8aF4FXEMdNMMuriPqwkORncW9ijpAUQMteJKA5qO_YPdZyJ6yQp__XO5UMaH6318gaUwG-w8bOd8Y2RsOBx_RxWaEICqHCd0hEUYZlrECrGHmyiorkIJCNE_N2iFGMkRdiw9Dmhww-spnW5FmClWFGSdVrqZMMEKihZYUWBYkvVD_I4h-f0ffWXhJGXtr8liJdvLJJLYyqCIL4069KJ9p6_HUdL44Dlr78cxrv2973SUopPZ7v2Kjy_YXGzLnF_xp6RrPJQ9m3EKTevf1680h1EchqMxwWNpSW1JjVBqkJcX_Cn4unBWm5CwPwwHCr99MsdkEd1oM-2hLpwaMhx7OFEqSdsfIyDym5dbfQGt7CZDUdGkFplBobFgpMTaUL8XRZpqAwbZNRbN_NCSARM7z89Jf6m2HPR39LV-l1mFlgGUigmWmjwWifVwCRVaDjkehlhJGGYm9bYVzxD1adO7TzV8s-4FLNE5beFT06YF2F4n2D-sXfUtlDfAzi8oQF2JuYOA90WbunsWcAWBpTbjHjB89unvIsP7gozI-qY31C5Umm807vLT-d3MQxuKhHb8o74-_zslUeWTqkfszQ_9JUbRA1H0a9Lkon_kgyl2z8J7_HKE7mIO01hdu3zlK6spQWHbeG0vNRL-PsbBCbWb2H5-hPMX637KiEyfo23v-AuMxUKFDLXKnhNWvp35Faz-TYrC6nTfAyzknFCWda-wFyK3GRShf2gvdLNRPktn42O-kudc_1t7knMVN-yUAuJLtdD5z1EiJwMXXLP0YaHTR&p=5&sk=&fvj=0,"Crystal City, VA","Experience applying data mining and machine learning techniques in a professional context. Knowledge of data mining and machine learning algorithms, theories,...",Data Scientist
http://www.indeed.com/cmp/Walmart-Ecommerce,Walmart eCommerce,http://www.indeed.com/pagead/clk?mo=r&ad=-6NYlbfkN0ASqHCEO9GpEUGjkXl8JxXxJB8G4bxm4-V1wqiPq6GTVg0dexUg4LUC1Xvy-Hj3JfvgW6Kn5vqROfEP7DBmdabnwGqVZXSr7gqBOaZltwR5TlPJtKzwqE1-IO0CXhoGzDGP3SoNTUll16uKR-Ip-64nt09sVjd03AMP8J4Tsmby8pD2wYDEhLLOTYfgdpHHiulQH2cBqJrENa7Pu44qjZnC9ZCeX4PZ-mSw2mb3CDK1oq0zgVQyIKahoC0Gaj1cc3RrlEkAtHAyRoiHYRCWw5wxbiQmndj7dPdDbb4_c8xVRiMFCQpHfDPP91mtkwGb2WUc4Q4EX6pIKBPtrX0ALbe7U8bFBI2Q2svVlabVb0R8kQW1oXsV00n3T5QJ9zA2PgL7a-6MDKMkmZHAN_Q3wcDo&p=1&sk=&fvj=0,"San Bruno, CA 94066","We employ big data at scale -- from machine learning, data mining and optimization algorithms, to modeling and analyzing massive flows of data from online,...",Data Scientist
,RS Energy Group,http://www.indeed.com/pagead/clk?mo=r&ad=-6NYlbfkN0AH4CKTkdT7E9kgGwiXtXtW04LsQVpZIo66s4kKwqvZTs19CBU-WfuablWFA-ZRFrlupi55B-j6m7nyTCH8RGDG80ArvTQlgPWVEK66fO4m5yrXI147eteX_rz9xEtjLzbPOdCWLu9z3nqT-BxQUrhirRsQs0RPamBdvahhox-AVtHVqE1EowwG4VaWFSixUjN4QiYI9ubLOCOjb3jJjQFd-7ot0HmwMF3Z0njliA_bN024ru3qHcEgKX32EBva1GRW3bP_fhAYIXF6VbKvwyBxm9VeVFAuHVrEyxE3KkpNY4EzTKtKP2gJVzEp7r20qRmBbcQI1C37dNSmevKRVVgInsbuJmczTh1_xR5qn3uO-o1wq1XKF6rCXE7BjYu0LkmKWr3NsPxfdn8pbRiHYkVoBxQ1qjBYZwt86wgfGXSaoVxNwtT01bkI&p=2&sk=&fvj=1,"Plymouth Meeting, PA",Working alongside Data Scientists to productionalize advanced computer science algorithms like machine learning and natural language processing....,Data Engineer/Scientist
http://www.indeed.com/cmp/Indeed,Indeed,http://www.indeed.com/pagead/clk?mo=r&ad=-6NYlbfkN0CiRNM7CVr8YueLFKlzwbFWI0o7IjV438l4sVrvKZ0fliTfoNv_ONF5FvJKNaJe41O5vUOqHByFV-Kbj5Y3ThgQQObxPdR8ypSHPTD0Fer3x1OFY1fvzVKlLPcdMTrwb68jqlrGSZRldd8bqmPUGuD2WUhMP02GuJBfE0llx_LDiFPebawCJCsfC0t2RQPY-hEkIOIZoY9s-sc7JK4Y21gugQzmhQ8WpIuuKDaqfV78Kk3d5k4svN9WNbkUCrQg_wuN0XeVRuXSdO21Edm2Gf6cu47SHvlNejfYLOdX40ZU1EjfGKh2OfJWkfvT9LG77Cii-Y64MATl7Yzbs0NIoJ14HNHrZD8rIzbT_Oeeg2Bs5yro16b-Lqb05aS0S0I4Sg02T517urCptnCAeJKWj8tXxC28Py6oXuG8V4KTrjpzS99fYPMYSWm60wipHlXFL7YONAsSDiYUtoJrRcjQDP4kJ0uslnKHiZieKtnDGNwTdw==&p=3&sk=&fvj=0,"Austin, TX 78731","As a Data Scientist at Indeed your role is to follow the data. We are looking for a mixture between a statistician, scientist, machine learning expert and...",Data Scientist
http://www.indeed.com/cmp/Solarcity,SolarCity,http://www.indeed.com/rc/clk?jk=ee6c768e31464412&fccid=4621e62387168258,"Salt Lake City, UT","They will send regular status reports, and will develop formal project action and communication plans prior to any launch....",Research Analyst
,HigherEducation.com,http://www.indeed.com/rc/clk?jk=4c16d3c5e079710b&fccid=e42b358bd361dfd0,"Houston, TX","Natural Language Processing, Machine Learning, Deep Learning, Recommendation Systems. Bonus points for experience implementing machine learning algos on GPU's...",Full-Stack JavaScript Developer & Data Scientist
http://www.indeed.com/cmp/AIG,AIG,http://www.indeed.com/rc/clk?jk=90b633d4c81e3361&fccid=9a92a4bf81326e1e,"New York, NY","Our Investment Analytics group was created in 2010, and functions as the primary resource within AIG’s Investment Management for asset modeling and related...",Quantitative Analyst - Investment Analytics
http://www.indeed.com/cmp/Lawrence-Livermore-National-Laboratory,Lawrence Livermore National Laboratory,http://www.indeed.com/rc/clk?jk=ae4ea27007947752&fccid=26727f1861532c63,"Livermore, CA 94550","Contribute to and actively participate with project scientists and engineers in the scope, planning, and formulating modeling/simulation efforts for physical,...",Postdoctoral Research Staff Member - Applied Statistics
,"Profusa, Inc.",http://www.indeed.com/rc/clk?jk=5e5fca18507fc69f&fccid=d2692e7c9f90a696,"College Station, TX","Working closely with a highly motivated team of scientists and engineers, the candidate will be responsible for carrying out the following duties:....",Research Physiologist
http://www.indeed.com/cmp/Cox-Communications-Inc.,Cox Communications,http://www.indeed.com/rc/clk?jk=0d5be930de3dcdd3&fccid=c7e6b037b4d816c9,"Atlanta, GA",The candidate will manage a team of MicroStrategy architects and report delivery professionals calling upon their understanding of best reporting and data...,Data Analysis Manager
http://www.indeed.com/cmp/S&P-Global-Market-Intelligence,S&P GLOBAL MARKET INTELLIGENCE,http://www.indeed.com/rc/clk?jk=5c86b8acbf2fa3d5&fccid=2c2386465bad2305,"Boulder, CO 80302","Gathering and organizing essential data, you will be handle massive amounts of data in multiple spreadsheets at a time....","Associate Research Analyst, Energy Forecasting"
,FMD K&L,http://www.indeed.com/company/FMD-K&L/jobs/Senior-Statistical-Programmer-Remote-021c77e56849d041?fccid=7d8e8f126dc80be0,"Fort Washington, PA 19034","Hands-on skills in legacy data conversions to CDISC SDTM data sets, good working experience in generating CDISC ADaM data sets and TLFs to support clinical...",Sr. Statistical Programmer-Remote (SDTM & ADaM)
,ASH Companies,http://www.indeed.com/rc/clk?jk=5d85b34595fd2598&fccid=8b8d2ea6dea7adef,"San Diego, CA",Minimum 1 year experience in the data analytics discipline (preferably health-related data). Ability to extract and analyze complex clinical and operational...,Research Statistician I
"http://www.indeed.com/cmp/Optimal-Solutions-Group,-LLC","Optimal Solutions Group, LLC",http://www.indeed.com/rc/clk?jk=41e81fed6f14c358&fccid=6a5b383eb7db0d4b,"College Park, MD","Real-Time Data Collection, Analysis, and Reporting More > Real-Time Data Collection, Analysis, and Reporting More > Real-Time Data Collection, Analysis, and...",Research Analyst I
,"Syntelli Solutions, Inc",http://www.indeed.com/pagead/clk?mo=r&ad=-6NYlbfkN0Dqrr-Rjg2XLksGNbp1zr5zrpCZUmaYUPA5zQ_vrCj_X6a_99tNJpNpXW6b2-NnzR-s72LGlIrkkvWFRwr2frmiwkGfTVc8Qgg6uKo4D4z8Hcb6niEHqdp_J0Q9g6aYSoYTmug_FVffV-BytzsyRywaboFAgMfaWQInBHxktx19jguDsWhOzmWGUPrTaUPldDsZMZjlWlEwvdTZ2xLbwLtFIuC4cUBjme8B8Xu7Wktz-sob2v1IrJz5jhfMfr7DPkDVzdYkL3j_O9JQKsIh_accjTCdhN1xt4phFFbZlF2rtYC1nfSYsTjYBSlrz8xEiYgRzxT6NAHRy67NpxUv4zWdwdsVI1Ys94pkwrurzAMDNNyncuId-ISXBA2HKA_fBBYzvgteot_gXun6CSw9CJmV0m21FIaz3u2ryrIrAQ7nbQ==&p=4&sk=&fvj=1,"Charlotte, NC 28277",Senior/Lead Data Scientist:. 2+ years as Senior/Lead Data Scientist. Lead role in our very fast growing Data Science team from marketing analytics perspective....,Data Scientist
http://www.indeed.com/cmp/Novetta,Novetta,http://www.indeed.com/pagead/clk?mo=r&ad=-6NYlbfkN0DZbghDog6eAFViHltrtimeH7IE6OveQ-GQud_7SkddKZ31ufd3YNXn3pfpzCV9ckU8aF4FXEMdNMMuriPqwkORncW9ijpAUQMteJKA5qO_YPdZyJ6yQp__XO5UMaH6318gaUwG-w8bOd8Y2RsOBx_RbxOkiikoUT5F-3Em65mfZzogLd2FKBKxUJy1fNt5vHGDDTHVqzslulWcrB9PBasi2KP-dycqlFOJWajKxgcukDPC_fy2TPit9J5RjI08o1PEub_8Mo556X2WIdfmyDp9oBG34zBNPCVq9HipiphcA8XdWYgNDxZDSr-H6DZpc-4shbqd7wT2BzMNSRg3hEDGNMrdeXZGKb_uZA22KwcdPr2FKh44Yiu0V2HK9emBT7VxI0okDMg5zk5DMQLkxv790hO5_l_QxvgIC7G3UyYBhpMWTVjY_9rpYFlFZy2mUs8vqNS0FUgy5kH3hKpq908Ah-iZA-rMMml6XFlkGxhGPvA6PbM1wSwaqWDnoUEeTPrRjRXo0W_G65bIUMfzwkOzcdtg25WOcqAk0crTZbLZHRaisPr1INnY0daO9wp3574ZxLvA5NQNiD4dwWxsKuD27BdMLigZ7TOgGvztTZ_Jg4OKrYjk4JHHQtMPSV-6EOtH-to2X2Zzc-qMP5ftpcPpYq8lwAk-K6xcrRWXU2N_a8OoX_zFZtf3lEkTICt67KdOFatsJJhAYTryDkRw7gWBLeH0QeEGBwChJzFnz5pevsH9WCGYSeKM6WMO4AOrETgDB6zsvet6H-4vMJxYZK5GxUP-ciDOFJR9BE8jjnwD9l5DxrBKQ_G11HvPHeC-PD0g4IXL0FNh3p0IMO2ARw2A&p=5&sk=&fvj=0,"Crystal City, VA","Experience applying data mining and machine learning techniques in a professional context. Knowledge of data mining and machine learning algorithms, theories,...",Data Scientist
http://www.indeed.com/cmp/Novetta,Novetta,http://www.indeed.com/pagead/clk?mo=r&ad=-6NYlbfkN0DZbghDog6eAFViHltrtimeH7IE6OveQ-GQud_7SkddKZ31ufd3YNXn3pfpzCV9ckU8aF4FXEMdNMMuriPqwkORncW9ijpAUQMteJKA5qO_YPdZyJ6yQp__XO5UMaH6318gaUwG-w8bOd8Y2RsOBx_RN4bXGl5hWkza3eNtN7Apkni31eDhP_ZsJY4RuMpENtxVAkOCIthDgyYM4V8jjy9DuLBspQr3EjxvajIlB00PlDIb5KSdDRnAb3bTDjo0LgYDPqDCbw6BPvK4tYB8MmIJXIwY41zFQIyprTHFic505pZ9x3DwEz7Pufmn22OQcOnTs-th1ii_gxWKwPsG56L5X_a41PMc2ahsKC0GFGRkGqpawuryIOKHHOFhWOoPL5m-5zgq83z3DQbnicDakVWZgdYNhn6sVyBe7RgUU0DtQUwNxkJsaZ0UndbQUHD1zy3MrHpiaCGdgYQUlIxYlAF5SoZdBmoh4_LseMv5wGkzXGTmiYvAN6S4-AV8XmJMSmSsdToRw1CQINOqUtTSEilzsvxVbpjGw48Z4nBkGS72QT_0ZG2R_eVo89VxBrzOczTq344_32iMUMCwSw3WFxdPfJJbooA6-WKkzoxbdWMA4bsXw7Ht2HbJsTyRylqc04B8k6imJ4MAQrjppEA4khoUFlC9WUAVzKFby1J-83BuHfUCQAL_-jldhGCOYuH0c1dIlvuA2c5jB8qcQEgrrE5i-hb1WoOh6Km2tJwe9eDzcJLx4XhAzQeNBDIMlPKJtO7zVDTNjzrYWBga_nPSY6grij7NReHWgny3gOZI2gNyMO8xHATR5H-0XoETu8quMYxCxNpKNRf1__sjMGU1I8Bu&p=1&sk=&fvj=0,"Crystal City, VA","Experience applying data mining and machine learning techniques in a professional context. Knowledge of data mining and machine learning algorithms, theories,...",Data Scientist
http://www.indeed.com/cmp/Walmart-Ecommerce,Walmart eCommerce,http://www.indeed.com/pagead/clk?mo=r&ad=-6NYlbfkN0ASqHCEO9GpEUGjkXl8JxXxJB8G4bxm4-V1wqiPq6GTVg0dexUg4LUC1Xvy-Hj3JfvgW6Kn5vqROfEP7DBmdabnwGqVZXSr7gqBOaZltwR5TlPJtKzwqE1-IO0CXhoGzDGP3SoNTUll16uKR-Ip-64ntrCB4Lw56s8hhVw7Uvxb7xs7uVFZxFDYbPQyBdnp7ug20d_sdDnICtOl2WkNqEHvpuS2aXf1q51k_v6nMLVSHAigY7NiJ_AbvI1AWLHR6xozZLnlcv70nTHDq2WFuQL6WX6XWpnyZnTIYms3C6ISg4euxyaMx0ne6EMksdQAG7LkVCibeh3g6X14qKE8HiGwiOZ6K0iZ5QQOACfl_d8j6IpQAKUOjqdzkacBcyzhIX9IoEiFLQn5dmAUeY_U71y-&p=2&sk=&fvj=0,"San Bruno, CA 94066","We employ big data at scale -- from machine learning, data mining and optimization algorithms, to modeling and analyzing massive flows of data from online,...",Data Scientist
http://www.indeed.com/cmp/Indeed,Indeed,http://www.indeed.com/pagead/clk?mo=r&ad=-6NYlbfkN0CiRNM7CVr8YueLFKlzwbFWI0o7IjV438l4sVrvKZ0fliTfoNv_ONF5FvJKNaJe41O5vUOqHByFV-Kbj5Y3ThgQQObxPdR8ypSHPTD0Fer3x1OFY1fvzVKlLPcdMTrwb68jqlrGSZRldd8bqmPUGuD2dJaen2YMHwfFrjPtLRrUpEAZME-TcQFg_BOCYOKtSMazrlNMkwedZLIzCcgutI_wpcu2COvaOxkKs_2to_u5_5_G1Vj2Smenvmqmd3JNI6-B2kiEXNX4MTs_53kZor7SUkWfp045IMx2FL4Kea9iXezmQ75Gmo485EHdR1eMaurPQJp9hbPBHH-wEVoXm967Hs3SA2w0hGJYed4JlX9OazTzRoBrxbKugECyA-Xgh2QcHK8X30ceQOWv5_-pcvEe4iO4hU9FVKnM3ZX5gA6ip7DpDj9sX4B3Rc7k3ib-yaUxLICdmR0PagujcPEdJ5EVsnJFIZ-vAonAAuM1rorf6g==&p=3&sk=&fvj=0,"Austin, TX 78731","As a Data Scientist at Indeed your role is to follow the data. We are looking for a mixture between a statistician, scientist, machine learning expert and...",Data Scientist
,ASH Companies,http://www.indeed.com/rc/clk?jk=5d85b34595fd2598&fccid=8b8d2ea6dea7adef,"San Diego, CA",Minimum 1 year experience in the data analytics discipline (preferably health-related data). Ability to extract and analyze complex clinical and operational...,Research Statistician I
http://www.indeed.com/cmp/Exos,EXOS,http://www.indeed.com/rc/clk?jk=ef6d123323edfe10&fccid=b67c8c59025f00b3,"Phoenix, AZ","Master’s degree with 3+ years’ analytic and data visualization experience in sports or health related fields (Statistics, Biostatistics, Epidemiology, Economics...",Data Analyst/Research Analyst II
,zignal labs,http://www.indeed.com/rc/clk?jk=44a6b3cf45416ef3&fccid=bcd185c836572b52,"San Francisco, CA","Data architect, data integrity, data quality, data scientist, data warehouse, database, database administrator, etl, mongo database administrator, sybase....",Data Engineer
http://www.indeed.com/cmp/National-Council-On-Crime-and-Delinquency,National Council on Crime and Delinquency,http://www.indeed.com/rc/clk?jk=c8a59f98236e8f4f&fccid=4c2379e29d133128,"Oakland, CA","The data scientist's specific tasks will include researching statistical learning models for data analysis, working with analytic platforms such as R or Python,...",Data Scientist
"http://www.indeed.com/cmp/Optimal-Solutions-Group,-LLC","Optimal Solutions Group, LLC",http://www.indeed.com/rc/clk?jk=41e81fed6f14c358&fccid=6a5b383eb7db0d4b,"College Park, MD","Real-Time Data Collection, Analysis, and Reporting More > Real-Time Data Collection, Analysis, and Reporting More > Real-Time Data Collection, Analysis, and...",Research Analyst I
http://www.indeed.com/cmp/Booz-Allen-Hamilton,Booz Allen Hamilton,http://www.indeed.com/rc/clk?jk=03a6e16151fac1aa&fccid=4e041af1d0af1bc8,"Alexandria, VA","Data Scientist, Junior. Applicants selected will be subject to a security investigation and may need to meet eligibility requirements for access to classified...","Data Scientist, Junior"
http://www.indeed.com/cmp/S&P-Global,S&P Global,http://www.indeed.com/rc/clk?jk=3cda040362c0715a&fccid=b716e44d2c6283e7,"Boulder, CO","Gathering and organizing essential data, you will be handle massive amounts of data in multiple spreadsheets at a time....","Associate Research Analyst, Energy Forecasting"
http://www.indeed.com/cmp/Galvanize,Galvanize,http://www.indeed.com/rc/clk?jk=b31d93ed259413cd&fccid=5609ae8cba643791,"Phoenix, AZ 85003 (Central City area)","Lead Instructor, Principal Data Scientist. Join us in building the world's hub for education in data science and data engineering....","Lead Instructor, Principal Data Scientist"
http://www.indeed.com/cmp/HP,HP,http://www.indeed.com/rc/clk?jk=61669d40341ee41f&fccid=1b866506aec22461,"Palo Alto, CA","Strong expertise in web analytics and website instrumentation using tools like Omniture, Google Analytics and Ensighten Experience in rolling out Web analytics...",Analytics Director
http://www.indeed.com/cmp/Amazon.com,Amazon Corporate LLC,http://www.indeed.com/rc/clk?jk=7ecc0789095c6688&fccid=fe2d21eef233e94a,"Seattle, WA","We have multiple positions available for applied scientists at all career stages, from graduating doctoral students to internationally renowned researchers and...",Machine Learning Scientist
,"Syntelli Solutions, Inc",http://www.indeed.com/pagead/clk?mo=r&ad=-6NYlbfkN0Dqrr-Rjg2XLksGNbp1zr5zrpCZUmaYUPA5zQ_vrCj_X6a_99tNJpNpXW6b2-NnzR-s72LGlIrkkvWFRwr2frmiwkGfTVc8Qgg6uKo4D4z8Hcb6niEHqdp_J0Q9g6aYSoYTmug_FVffV-BytzsyRywaboFAgMfaWQI2JN7mgIpjBPX_F4THPOrGh-L2CpiDdyxdqhlMUWTUg2WBKBHL3SD3fB_TqZfcX9T1YQtal_DEbko9FClDjSCSy-PhY_doi9_j3kUoTlgiXJYElj_hofeiHGgL5jTmmN-Iv91UfCqJOYhL7LnL0Xm13zLRPMmCiL_MIOmKGaHWJgVrRgI3FXkwE8JGp4QzW0wMjX_hF0RwxKnnfLg6PAgEDoRhLbuOkZaWkdjv_m-xRT0iPHsgLUFNofnRqh43HRePOoTp5aWYEA==&p=4&sk=&fvj=1,"Charlotte, NC 28277",Senior/Lead Data Scientist:. 2+ years as Senior/Lead Data Scientist. Lead role in our very fast growing Data Science team from marketing analytics perspective....,Data Scientist
,RS Energy Group,http://www.indeed.com/pagead/clk?mo=r&ad=-6NYlbfkN0AH4CKTkdT7E9kgGwiXtXtW04LsQVpZIo66s4kKwqvZTs19CBU-WfuablWFA-ZRFrlupi55B-j6m7nyTCH8RGDG80ArvTQlgPWVEK66fO4m5yrXI147eteX_rz9xEtjLzbPOdCWLu9z3nqT-BxQUrhirRsQs0RPamCGgihul3xIgoRFMCA20Jg1tyc9CCu_3hPQlgv9cQR0aiRw4-MaBaxxws6BHVLyUUFi70CbyL8udalFZEWnGcenhmSiTFrfXMMSq48NssyxsHI1gde7mhx9TRMGPISJWNJkCEh7ZL0HoOchtSDnpIZeuwqwnuk8aclkoT0b099dfxob8NngX2tKlZCBsCm0ParCrL5uX7YJ4_ECGOjP5Kc1UnlgPG3ZBjhSy4SJwYTdZ5P5EnncLKIn_Q-QmFmz9P-Uu5bjtwJz8PQZv15iDNZ_&p=5&sk=&fvj=1,"Plymouth Meeting, PA",Working alongside Data Scientists to productionalize advanced computer science algorithms like machine learning and natural language processing....,Data Engineer/Scientist
,RS Energy Group,http://www.indeed.com/pagead/clk?mo=r&ad=-6NYlbfkN0AH4CKTkdT7E9kgGwiXtXtW04LsQVpZIo66s4kKwqvZTs19CBU-WfuablWFA-ZRFrlupi55B-j6m7nyTCH8RGDG80ArvTQlgPWVEK66fO4m5yrXI147eteX_rz9xEtjLzbPOdCWLu9z3nqT-BxQUrhi11CSkeMJCjzQyf_FFuEMjXoF8n4rCHMAeOfvebw3VZMYqAQ-MxQnIeiw23bQKGh823KVeJdqTCGhnkgI3sDMluva2hl3UZ3mFfhPfFJKi9mrkDVaAaQ0SpbCRs811MwpMLJ22CDQF8Km4kYIi3DzIvc0aXI964-nHIDA5YakHqFbmMK1i4ID39gFqJRtq298AAauLAF2W1fY2wds8-lst67gpMp6nnPQTMoZownHPuthAo3ZdrwrDrJX75pcEePDXkW1eTkBNDDdnVvFy0SSZsxssnFWaEjz&p=1&sk=&fvj=1,"Plymouth Meeting, PA",Working alongside Data Scientists to productionalize advanced computer science algorithms like machine learning and natural language processing....,Data Engineer/Scientist
http://www.indeed.com/cmp/Walmart-Ecommerce,Walmart eCommerce,http://www.indeed.com/pagead/clk?mo=r&ad=-6NYlbfkN0ASqHCEO9GpEUGjkXl8JxXxJB8G4bxm4-V1wqiPq6GTVg0dexUg4LUC1Xvy-Hj3JfvgW6Kn5vqROfEP7DBmdabnwGqVZXSr7gqBOaZltwR5TlPJtKzwqE1-IO0CXhoGzDGP3SoNTUll16uKR-Ip-64noRWubsT-hL9x38OQqzUn0sGxu4BgYTsingp47QeUu8VtcnQHir8EqgnzNkrsuQYAqIqylevm5bZix8tY6ZXzoXBSqtrXHFHlybVEoxZrguEUR8xiVpvRMg43ObCd3NSioRW9LlvB0Br6U4NuZ3nhKTedep8IAbwaSaJZVGsU1Wgcl611yNxdsYX_PJWy7_NNvhoW9LsjyPt501mdB96iZOY_rbHmOcn4iR96cHBcijUrvOQkh-IfYp192F7rD6rD&p=2&sk=&fvj=0,"San Bruno, CA 94066","We employ big data at scale -- from machine learning, data mining and optimization algorithms, to modeling and analyzing massive flows of data from online,...",Data Scientist
http://www.indeed.com/cmp/Indeed,Indeed,http://www.indeed.com/pagead/clk?mo=r&ad=-6NYlbfkN0CiRNM7CVr8YueLFKlzwbFWI0o7IjV438l4sVrvKZ0fliTfoNv_ONF5FvJKNaJe41O5vUOqHByFV-Kbj5Y3ThgQQObxPdR8ypSHPTD0Fer3x1OFY1fvzVKlLPcdMTrwb68jqlrGSZRldd8bqmPUGuD2853k5q39g11teSxrghJLDKDJYiw9MPGMFdXPU_3qPoovdHJZJu51ApfkDdZwnwu0tw4y-arNJCvDhQ_Vkapq08g0yxgTkIuXVZBbqJaItXkFLU4XhvxcdJTj5eVQcnd7gFqrt4onvBk3Pacj3bCbmWjOYlPecyF2P2gMY7IzFs381H40OL4Kxw_rUjSnK37lhbzxjMUODHPr4eauaZMmEHQHNWlk8_sDIYoEzTEN2YRLFKI9pb3-ekprRKiEYb_kFsbMSH5brOSOBjAceG84xeQ6Cfn4LSkC5OKfEn2hreFcKjAo3_EBVHfb9WUwPicXRVMR7K4S0umBUyUMOrBe6A==&p=3&sk=&fvj=0,"Austin, TX 78731","As a Data Scientist at Indeed your role is to follow the data. We are looking for a mixture between a statistician, scientist, machine learning expert and...",Data Scientist
,"HKS, Inc.",http://www.indeed.com/rc/clk?jk=75e2586ba2c15af0&fccid=eeacc0680a513c9d,"Dallas, TX 75201 (City Center District area)","Working knowledge and experiences in data design / dimensional data modeling. HKS is a team of more than 1,300 architects, interior designers, urban designers,...",Business Intelligence Developer
http://www.indeed.com/cmp/Centra-Technology,Centra Technology,http://www.indeed.com/rc/clk?jk=c83714b8626e8502&fccid=b3aefa89185b49b3,"Tysons Corner, VA","We offer a full range of benefits, including competitive salary, comprehensive health plan including dental coverage, company-paid life & disability insurance...",China Policy Research Analyst
http://www.indeed.com/cmp/University-of-California---SAN-Francisco,University of California San Francisco,http://www.indeed.com/rc/clk?jk=75baf9c247261438&fccid=2a341562d64c7cdb,"San Francisco, CA",Scientific background and/or experience in clinical research with basic scientific methodology and neuroanatomy....,Research Assistant
http://www.indeed.com/cmp/Square,Square,http://www.indeed.com/rc/clk?jk=8bf10010c7c26a6b&fccid=09abad886b83c501,"San Francisco, CA 94103 (South Of Market area)","Ability to work well with data scientist and data engineers. In this role you will collaborate closely with data engineers, data scientist, business analysts,...","Project Manager, Data"
http://www.indeed.com/cmp/National-Council-On-Crime-and-Delinquency,National Council on Crime and Delinquency,http://www.indeed.com/rc/clk?jk=c8a59f98236e8f4f&fccid=4c2379e29d133128,"Oakland, CA","The data scientist's specific tasks will include researching statistical learning models for data analysis, working with analytic platforms such as R or Python,...",Data Scientist
http://www.indeed.com/cmp/IBM,IBM,http://www.indeed.com/rc/clk?jk=45b4693f9c85cdd0&fccid=de71a49b535e21cb,"Cambridge, MA 02142 (East Cambridge area)",Support training and orientation of new hires to Custom Data Analytics or others within Truven Health Analytics....,Watson Health - Research Analyst II - Truven
http://www.indeed.com/cmp/Wsp-Parsons-Brinckerhoff,WSP | Parsons Brinckerhoff,http://www.indeed.com/rc/clk?jk=781319413fc707e3&fccid=a0ecbc8328064f26,"Sacramento, CA","Approximately 34,000 employees, including engineers, technicians, scientists, architects, planners, surveyors, program and construction management professionals...",Sustainability Compliance Analyst
http://www.indeed.com/cmp/University-of-Memphis,University of Memphis,http://www.indeed.com/rc/clk?jk=ec045ee8f99d717b&fccid=ce99770231d62b8c,"Memphis, TN 38152 (East Memphis-Colonial-Yorkshire area)",Uses predictive analytics and data mining ( SAS Enterprise Miner) to develop data models for student enrollment management and student success....,Research Analyst II
http://www.indeed.com/cmp/Blackbaud,Blackbaud,http://www.indeed.com/rc/clk?jk=24abcdabfe847341&fccid=28da867cd53af9db,"Charleston, SC 29492","Target Analytics is the leading provider of data-driven analytic solutions for non-profit fundraisers. Collect, organize, interpret, and present data using...",SAS Statistician
http://www.indeed.com/cmp/Centers-For-Disease-Control-and-Prevention,Centers for Disease Control and Prevention,http://www.indeed.com/rc/clk?jk=96b921302882c22b&fccid=3e901f592b439cea,"Atlanta, GA","Whether we are protecting the American people from public health threats, researching emerging diseases, or mobilizing public health programs with our domestic...",Supervisory Health Scientist
