company_link,company_name,job_link,job_location,job_summary,job_title
http://www.indeed.com/cmp/Indeed,Indeed,http://www.indeed.com/pagead/clk?mo=r&ad=-6NYlbfkN0CiRNM7CVr8YueLFKlzwbFWI0o7IjV438l4sVrvKZ0fliTfoNv_ONF5FvJKNaJe41O5vUOqHByFV-Kbj5Y3ThgQQObxPdR8ypSHPTD0Fer3x1OFY1fvzVKlLPcdMTrwb68jqlrGSZRldd8bqmPUGuD2Rs9hxOPsog_WgBySd3WniByqXxsSNLYJZWL4SKBhV62A7hQ6ukLM4RDCjPXawv7UJUzA_yfI5t1A4tOb5idDyvs8ATv3Z3cvqXLKwWnjD7vh4A_DoTXf5dxb0OChmwm8GLuur9BLp-cT2cDD3z9N19N4dnfgSKGAVjqhEI5iQYvxB55juYAMjaFWR56-xq33_Qwr2e45NpURn6DVtPOhQx9p6y4QxddG98CE8cV4ZlTeavf7RFuuDsAUC-5OTOoGDaMTT84KUdyBoeE5UyQYwBHSa0M9nsLHRmwhBFOYbnRZ3g-2gvNGzB73oN4bwdJEdC_lI-nLuOTdjRja4ZN67g==&p=3&sk=&fvj=0,"Austin, TX 78731","As a Data Scientist at Indeed your role is to follow the data. We are looking for a mixture between a statistician, scientist, machine learning expert and...",Data Scientist
,"Syntelli Solutions, Inc",http://www.indeed.com/pagead/clk?mo=r&ad=-6NYlbfkN0Dqrr-Rjg2XLksGNbp1zr5zrpCZUmaYUPA5zQ_vrCj_X6a_99tNJpNpXW6b2-NnzR-s72LGlIrkkvWFRwr2frmiwkGfTVc8Qgg6uKo4D4z8Hcb6niEHqdp_J0Q9g6aYSoYTmug_FVffV-BytzsyRywaQkPNiyJWrWZFdZjDZIAE0DVGcSS4rVdtzx7GjVzEb7cRUj4NWb0XuFnWjaN4ZAMx1XE37h-ehH5T447BzSjI0-834k-P2_dZ_vrwWqzjtXRWhzLuMo4ycPhRaPCoq4FSGiIbqKHvvqWNHKw7CfBu4Ue4ceajanPOln3NZ3nX0WaMTZhxQm3JFzqT4tkO4fgIE7HnBPBQIzsHCBQ5k7og_wBGZwIS960SEJ74eR-mPTJUFKbl1eZ8sHfWaS022WrFhygmII9V01YaNyPJxzK0Og==&p=4&sk=&fvj=1,"Charlotte, NC 28277",Senior/Lead Data Scientist:. 2+ years as Senior/Lead Data Scientist. Lead role in our very fast growing Data Science team from marketing analytics perspective....,Data Scientist
,RS Energy Group,http://www.indeed.com/pagead/clk?mo=r&ad=-6NYlbfkN0AH4CKTkdT7E9kgGwiXtXtW04LsQVpZIo66s4kKwqvZTs19CBU-WfuablWFA-ZRFrlupi55B-j6m7nyTCH8RGDG80ArvTQlgPWVEK66fO4m5yrXI147eteX_rz9xEtjLzbPOdCWLu9z3nqT-BxQUrhih62J4dtbIARlBNvkXKzlkgM0s5MUDs8Ku8Esib4NKNdfJnDW4_O75UXi4yKqI7-v0hqXw4tTDNcyNLRTQOgjr_mUEsVp43GJ7jx1etgxEUwQFyHksXG92611Zq8o967FaAyM1tkGJwk876LoMQ0BT21VadAtpQioNyM38JeY7vNXVkNCJSd1T180luBYh8idxwY-tI7w4ncoO37NZHTGi2rOEsJhlSW-tL5eFpNE5d7OUrjcss3E0VNIkWiTf8GpA1_-O2bo-TuZIp4FI_gk8KetYUmX2EW6&p=5&sk=&fvj=1,"Plymouth Meeting, PA",Working alongside Data Scientists to productionalize advanced computer science algorithms like machine learning and natural language processing....,Data Engineer/Scientist
http://www.indeed.com/cmp/Novetta,Novetta,http://www.indeed.com/pagead/clk?mo=r&ad=-6NYlbfkN0DZbghDog6eAFViHltrtimeH7IE6OveQ-GQud_7SkddKZ31ufd3YNXn3pfpzCV9ckU8aF4FXEMdNMMuriPqwkORncW9ijpAUQMteJKA5qO_YPdZyJ6yQp__XO5UMaH6318gaUwG-w8bOd8Y2RsOBx_RBQgEAJZM8e7ikQQB_dVMMe3z7aRMceC2aexv0gyOyTMtDgp4f2k70ihFtAZtVK5mzteuWG3FEuWRB3JhnHepjBz_Mi0FeGzou7g_whaa4QjR0sdbVrhglYUpVQAiKAeDGO8vEnDlNEtK99AUkqWA04UBNtMIF_I0ykFz634mytpcnqTutjEBj5SQN-0rX7IkNNZa4IC918uZHtPXRsX9s1SGXREDCK_VTuxoO_eSb0aRYbROMV68sPIzWsGKufNezM8tNxHd3-QKo1Yo0e_8EgoRJtZeEr_z0exttzBkHZ7k48yt0E8zJUw5eYT1ebVAb8YKUFZG_Nuy9HInKaDp8y9IwE6Nm2yzMN83K6UmtwYRxhUiRi9Dng-_CYfvSfzsrfcRoIPrwuiJDTrVw8lx1yayI6zd8gqB4_IBKtgt4GNfXxExjy_eZHKVHwTM9hNaU_tJajZi8lCg_Is-X-V97xV-QErcIcsRq5iXM4k_RZzfgLnRT_lAq5eZyQ3CQU1T3fmGapInsw5A3jQhuDI1fWrTp_EbnUVMPNui3IKG2rpa-zdJqDdNUgGLKRwiWjZAGmz_9654O6lcO-KJ69DX93PjIbW1ZufURGCBgBelcX0LebWdnZFU79R_x7PPgLiDU6uU-j_dWea0bPKQ7M6kYY-veASDY4SjE_kLUDzJ-ZnSEEoAZ1EIhrfbNoGLIFHf&p=1&sk=&fvj=0,"Crystal City, VA","Experience applying data mining and machine learning techniques in a professional context. Knowledge of data mining and machine learning algorithms, theories,...",Data Scientist
http://www.indeed.com/cmp/Walmart-Ecommerce,Walmart eCommerce,http://www.indeed.com/pagead/clk?mo=r&ad=-6NYlbfkN0ASqHCEO9GpEUGjkXl8JxXxJB8G4bxm4-V1wqiPq6GTVg0dexUg4LUC1Xvy-Hj3JfvgW6Kn5vqROfEP7DBmdabnwGqVZXSr7gqBOaZltwR5TlPJtKzwqE1-IO0CXhoGzDGP3SoNTUll16uKR-Ip-64n5KLnCDVE9ct9IL46bGQWDG3OhZZgpWyltQ-RMxkpk1-w2V6nUX1irrpGjxXuckzc5hR9qTb_AyBMbGlJ6r2f5GbUIMG4Ih0JCJ698jEfppOh7Eil2hGiDZWtBJ9tthX7_RSyTq5TVpXs9K_XOWjaRMZSlGaAIU0x4oU3ZLYC-s61wFioilon7UGxLhD80yPJ-WaOAb9IaNq9RDTuRle2aI5fjQcS8UJSVKSUTGRIHLUTJ8X4qSlWSeoCN9cH4wi0&p=2&sk=&fvj=0,"San Bruno, CA 94066","We employ big data at scale -- from machine learning, data mining and optimization algorithms, to modeling and analyzing massive flows of data from online,...",Data Scientist
"http://www.indeed.com/cmp/Cornerstone-Environmental-Group,-LLC","Cornerstone Environmental Group, LLC",http://www.indeed.com/rc/clk?jk=9137ea4726a1bebe&fccid=225bbd4519baf6de,"Dublin, CA",Environmental Scientist / Compliance Project Manager. Bachelor’s or Master’s degree in an Environmental or Scientific discipline with 5-10 years of relevant...,Environmental Scientist/Compliance Project Manager
http://www.indeed.com/cmp/Schneider-Electric,Schneider Electric,http://www.indeed.com/rc/clk?jk=5915916a19824c23&fccid=8dc4399ddb463d4a,"Burnsville, MN","You will engage with business partners and facilitate collaboration among product management, designers, data scientists, content specialists, and product...",Product Manager – Agronomy Specialist
http://www.indeed.com/cmp/Ball-Aerospace,Ball Aerospace,http://www.indeed.com/rc/clk?jk=3cae467b5658cac8&fccid=82c5e27e77990fa2,"Broomfield, CO","Our team of more than 3,000 engineers, scientists, technicians and support staff drives all the achievements at Ball Aerospace....",Production Control Center Scheduler (660509)
http://www.indeed.com/cmp/Ashland,Ashland,http://www.indeed.com/rc/clk?jk=42d20b4036bc5f6c&fccid=7ef400c2ff148650,"Wilmington, DE 19808","Leverages peer networks, external resources and experts to understand applicable trends and best practices for big data, predictive analytics, predictive...",Business Solutions Manager
http://www.indeed.com/cmp/Precision-For-Value,Precision for Value,http://www.indeed.com/company/Precision-for-Value/jobs/Senior-Account-Executive-9a7fc899870fc67a?fccid=7bb6931b3a51e34f,"Costa Mesa, CA","At Precision, you will collaborate with teams that include former payers, data scientists, health economists, marketing strategists, and promotional...",Senior Account Executive
,The Washington Center for Equitable Growth,http://www.indeed.com/rc/clk?jk=a0ef3f959f1b0e0d&fccid=47f8fecaaae7e470,"Washington, DC","A core component of Equitable Growth’s mission includes providing grants to academic economists and social scientists to support new research on inequality,...",Grants & Finance Assistant
http://www.indeed.com/cmp/New-York-University,NYU School of Medicine,http://www.indeed.com/rc/clk?jk=34f5aad387ed55a6&fccid=8077183a161ef0fd,"New York, NY","Project Support Provides project/program support to a supervisor, department, or organizational unit in the preparation of project relevant materials that...",Project Assistant
http://www.indeed.com/cmp/Citrine,Citrine,http://www.indeed.com/rc/clk?jk=789a90f2f9863e68&fccid=7315464251fe4422,"Redwood City, CA",Deploy machine learning infrastructure & visualizations to a worldwide network of scientists developing next generation functional and structural materials....,Senior Software Engineer
http://www.indeed.com/cmp/Camden-Coalition-of-Healthcare-Providers,Camden Coalition of Healthcare Providers,http://www.indeed.com/rc/clk?jk=44fdd64b3af7a14e&fccid=829aa8b3bd85c169,"Camden, NJ 08102","Analysts, data scientists) and external clients to develop the technology that empowers them to drive change....",Senior Software Engineer
http://www.indeed.com/cmp/Microsoft,Microsoft,http://www.indeed.com/rc/clk?jk=20357f5f5b87f176&fccid=734cb5a01ee60f80,"Redmond, WA 98052","Work directly with 3rd party engineers as well as internal Windows engineers and data scientists to identify, debug, and resolve quality issues with apps....",Principal Program Manager
http://www.indeed.com/cmp/Indeed,Indeed,http://www.indeed.com/pagead/clk?mo=r&ad=-6NYlbfkN0CiRNM7CVr8YueLFKlzwbFWI0o7IjV438l4sVrvKZ0fliTfoNv_ONF5FvJKNaJe41O5vUOqHByFV-Kbj5Y3ThgQQObxPdR8ypSHPTD0Fer3x1OFY1fvzVKlLPcdMTrwb68jqlrGSZRldd8bqmPUGuD2v7QEAUk-EMe_J8wjMbbOCh0dmt8qYybBAaML7hphrz-hzQwb9WHKEOUVpQC7IYB331Y0qsPxnM2GrpzzSgMhVyMz6UDytsZSIfqzcXayLKHCE7HfB3FvR83RJ9rpunjLLfuBoLstzkzGr7fT3NZNPJBJQWDf-aHehWHrIBu1bFP5EKxx4WAN58BGdvyomBLs5eahUP-uGH5WroHoMKebDa9xr95Vf-RWW12hdUwNsbdpUYnkCo-8-IrPhCdqy8zVGUhmBGaXkW56WgElkeo9PK3s4Rk8JVLFzXlDoiCc4Tw87sAH8RRiCshutpH-bJW3LuVpPYWcxrEojHKYPxjGew==&p=3&sk=&fvj=0,"Austin, TX 78731","As a Data Scientist at Indeed your role is to follow the data. We are looking for a mixture between a statistician, scientist, machine learning expert and...",Data Scientist
,"Syntelli Solutions, Inc",http://www.indeed.com/pagead/clk?mo=r&ad=-6NYlbfkN0Dqrr-Rjg2XLksGNbp1zr5zrpCZUmaYUPA5zQ_vrCj_X6a_99tNJpNpXW6b2-NnzR-s72LGlIrkkvWFRwr2frmiwkGfTVc8Qgg6uKo4D4z8Hcb6niEHqdp_J0Q9g6aYSoYTmug_FVffV-BytzsyRywaQkPNiyJWrWZX4UYs7k-VDiB8BrKHstoYtLqZF-FcQlj7ZrZ1xurWKrHVT0yQsqBdZYQEZ0YGc7RwE7cjXfDtO1eOr57jeinnp6S7_krvDzAyL5H470uzoUOHhVoQDdfz5G-7hZ0dbgbGx0gacVBw2qbgGJS_hb0FhMFeBDMlVjxkqI1nbPzVkgKvyvew_N8Y8BYxPezzKs69W7kClkZ0cogJxLfb2gW-6GR9FgQhm58oL-LNYaIqBDttoVVLSDI4qEkteobNlgO-PDGZmXN_AQ==&p=4&sk=&fvj=1,"Charlotte, NC 28277",Senior/Lead Data Scientist:. 2+ years as Senior/Lead Data Scientist. Lead role in our very fast growing Data Science team from marketing analytics perspective....,Data Scientist
,RS Energy Group,http://www.indeed.com/pagead/clk?mo=r&ad=-6NYlbfkN0AH4CKTkdT7E9kgGwiXtXtW04LsQVpZIo66s4kKwqvZTs19CBU-WfuablWFA-ZRFrlupi55B-j6m7nyTCH8RGDG80ArvTQlgPWVEK66fO4m5yrXI147eteX_rz9xEtjLzbPOdCWLu9z3nqT-BxQUrhih62J4dtbIASbpkKePcCJJsyRR0Qav5erSY7X_fZ043qiL1JYc-Mh9HkBGy3dgxVyg9dwF_sdSUIa_le40_I_AH1na_VPatTeunkNHmg2pmLJLjQf0BbVlVOusPI76FNc9EmYbUawjnpix5o7yN2X7zZ2xSvySsStY6lZW8s9HgVD6Fuqk0lT8l3c_IzanwU_hdXE0R9SAfVPa6v9-rw1gK3Z-mlXMbkJOH2IQK9dY8Hhm-wiMlK-eSlXeNTn5s94Da2LBJOMuF86-y8NnByTAMiSE8adVMNR&p=5&sk=&fvj=1,"Plymouth Meeting, PA",Working alongside Data Scientists to productionalize advanced computer science algorithms like machine learning and natural language processing....,Data Engineer/Scientist
http://www.indeed.com/cmp/Novetta,Novetta,http://www.indeed.com/pagead/clk?mo=r&ad=-6NYlbfkN0DZbghDog6eAFViHltrtimeH7IE6OveQ-GQud_7SkddKZ31ufd3YNXn3pfpzCV9ckU8aF4FXEMdNMMuriPqwkORncW9ijpAUQMteJKA5qO_YPdZyJ6yQp__XO5UMaH6318gaUwG-w8bOd8Y2RsOBx_Rsh3JtNQZRRrMRPi1L865DjnLUtx4K65jOW8XXxXE_qWGwgXRjSgxY7AqiSTUlHmZSiP95D7V-8jDnXVon2dI3EAGROVUgoa-_I0zCT9a0rz8_5BL9u71kB1H87kLM1VtytcSuFkujflTbuWHYtWzWHjkEDlwLwgxUHX7ZcqdfIPuIkD9oTe7Xo_XZXnBstS_tj7wHm28nVPadvPes6n4S4EjiyLwSrmTjmzRrLDokRjMH-xV1u1j5EOXDBCo-Z2GR3eAuxH788yHgs6nkJckLJHWojYG_x0CJ_SUZBCqb-j0q7DQ6j1E_sB7lEuG24uQyieDEEHxDDPj3jp0QNaR6rP2HDNBZFDwO1zZZqicSHgPSLwI9n8oIyT011DXQ0r_SNsSz0nVVjVjf1S657b7Dx4VslfMwn1Qtdi7yTxDEpXjBlnfvqJSvO_Z9HtbXJTe7jfvVbqD2hONNt0i5UQ692ZpdtYYSv-zaiL6skDJvBKaE3sLWsd_qWd5Shvlc-xqwUTHjX71qH1gmPW-bUM5OnyCy1QotOh5Pv4eOtQaimdeI-XnEIwiWRH0QsCTYGc2zNu38MTH2QXEn8OpVVGV3dUx5TnwEN7LKc1nYfPLxdgh4LaCYgOUDX7kV1WLshmii7gR5XtnhGjF5TJul_uMMbLBiT-kjXH2s9xWe5cbBrEHj21X4E1GyWA8r6VPiTdC&p=1&sk=&fvj=0,"Crystal City, VA","Experience applying data mining and machine learning techniques in a professional context. Knowledge of data mining and machine learning algorithms, theories,...",Data Scientist
http://www.indeed.com/cmp/Walmart-Ecommerce,Walmart eCommerce,http://www.indeed.com/pagead/clk?mo=r&ad=-6NYlbfkN0ASqHCEO9GpEUGjkXl8JxXxJB8G4bxm4-V1wqiPq6GTVg0dexUg4LUC1Xvy-Hj3JfvgW6Kn5vqROfEP7DBmdabnwGqVZXSr7gqBOaZltwR5TlPJtKzwqE1-IO0CXhoGzDGP3SoNTUll16uKR-Ip-64ngLCWSO4A7E0atjK3BkTCOpx1IS5wVdWRjPLv9djojs05yOVR1wpjVxR4x6wxb8KO-TBo3wouY-Yu7oIrnIUWKy-blo8ym4_UtKly_-Sl4mQEE9aBuSTF2Iok1SWVPwVhz5CkXx5KP8AfLIY9gsdJhQa09nYb4Utvg5rBeDhXEW7Wq-DfU-fMkENoBNMNc_KHvue45Friymt0Fb5IN6xnYL0y80icoay4rNRZcgLLW4NQiKMokgrV7UcaKfTBQHf4&p=2&sk=&fvj=0,"San Bruno, CA 94066","We employ big data at scale -- from machine learning, data mining and optimization algorithms, to modeling and analyzing massive flows of data from online,...",Data Scientist
http://www.indeed.com/cmp/Citrine,Citrine,http://www.indeed.com/rc/clk?jk=789a90f2f9863e68&fccid=7315464251fe4422,"Redwood City, CA",Deploy machine learning infrastructure & visualizations to a worldwide network of scientists developing next generation functional and structural materials....,Senior Software Engineer
http://www.indeed.com/cmp/Altair-Engineering,Altair Engineering,http://www.indeed.com/company/Altair-Engineering/jobs/Design-Release-Engineer-edc7a0947a715207?fccid=3453268f43beb582,"Dearborn, MI","Altair ProductDesign is a global, multi-disciplinary product development consultancy of more than 700 designers, engineers, scientists, and creative thinkers....",Design and Release Engineer - Control Module
http://www.indeed.com/cmp/Merck,Merck,http://www.indeed.com/rc/clk?jk=1b0aae8b935e94dc&fccid=c38b7d5e0419a6a7,"Gwynedd, PA",Understanding of clinical research process from clinical program/trial planning to regulatory submission....,Clinical Scientist Job
http://www.indeed.com/cmp/Camden-Coalition-of-Healthcare-Providers,Camden Coalition of Healthcare Providers,http://www.indeed.com/rc/clk?jk=44fdd64b3af7a14e&fccid=829aa8b3bd85c169,"Camden, NJ 08102","Analysts, data scientists) and external clients to develop the technology that empowers them to drive change....",Senior Software Engineer
http://www.indeed.com/cmp/Microsoft,Microsoft,http://www.indeed.com/rc/clk?jk=20357f5f5b87f176&fccid=734cb5a01ee60f80,"Redmond, WA 98052","Work directly with 3rd party engineers as well as internal Windows engineers and data scientists to identify, debug, and resolve quality issues with apps....",Principal Program Manager
http://www.indeed.com/cmp/Execu%7Csearch,Execu | Search,http://www.indeed.com/rc/clk?jk=3ae60af75f6ca69b&fccid=1d60172167b02068,"New York, NY","Evaluate current and long-term trends across several industries. Execute in-depth industry analysis using resources such as market data, economic news and...",Equity Research Analyst
http://www.indeed.com/cmp/Ashland,Ashland,http://www.indeed.com/rc/clk?jk=5269c2ffae23c3d9&fccid=7ef400c2ff148650,"Wilmington, DE 19808","Our people—molecular scientists, chemists, process engineers, logisticians, research scientists, economists, analysts, compliance auditors, salespeople, safety...",Business Solutions Manager: Go-to-Market
http://www.indeed.com/cmp/The-University-of-California,"University of California, Santa Cruz",http://www.indeed.com/rc/clk?jk=4a8c94a7c59bbdd3&fccid=26da5e76f463c0fb,"Santa Cruz, CA 95064","Assistant Project Scientist, Step 1. The successful applicant will support an interdisciplinary NSF-funded project exploring the influences of biogeochemical...",Institute of Marine Sciences: Human and Physical Geographer
http://www.indeed.com/cmp/Trout-Unlimited,Trout Unlimited,http://www.indeed.com/rc/clk?jk=32ac707036d41c92&fccid=1e92808f2ca7f3e3,"Arlington, VA","This dedicated grassroots army is matched by a respected staff of organizers, lawyers, policy experts and scientists, who work out of more than 30 offices...",Membership Services Coordinator
http://www.indeed.com/cmp/University-of-Wisconsin%E2%80%93madison,University of Wisconsin–Madison,http://www.indeed.com/rc/clk?jk=8bcae1fda3906cd4&fccid=22b1d1aaa50a1a45,"Madison, WI","The Educational Neuroscience Lab invites applications from bright, motivated individuals to manage an National Institute of Health (NIH) R01-funded project...",LAB MANAGER - EDUCATIONAL NEUROSCIENCE LAB
http://www.indeed.com/cmp/Indeed,Indeed,http://www.indeed.com/pagead/clk?mo=r&ad=-6NYlbfkN0CiRNM7CVr8YueLFKlzwbFWI0o7IjV438l4sVrvKZ0fliTfoNv_ONF5FvJKNaJe41O5vUOqHByFV-Kbj5Y3ThgQQObxPdR8ypSHPTD0Fer3x1OFY1fvzVKlLPcdMTrwb68jqlrGSZRldd8bqmPUGuD2iArkOV1sKfqA_UnOqs1DAvhdm2LchXWvSmSPAZFCt2r2dxm2_W3eBPalTrM3pErCcR6Fde3QAzHFWIRNpo1EbQ-ufVhO-6VwVAisj5p9YP0qPHznszPaSKHn9P4VQNoSEn0XKKbs-H0CSZ_0PxftQBNddDK4TGjDZ_uV9t3s-92htS0GWLjnLUnZoKK_p8pZwULWp8LNROYU_CFm8bmSuQbYkuhy-Wi4_6ekuRpoif2c70pc7xxGbNuconT855m0XxFNVgCuFA18ttIWJo-P4G5syXEUQVcKluAqzzHg5EZydrNiJadget-evMrVLkFq-uTYl1hiEwurLalJDSrZMA==&p=3&sk=&fvj=0,"Austin, TX 78731","As a Data Scientist at Indeed your role is to follow the data. We are looking for a mixture between a statistician, scientist, machine learning expert and...",Data Scientist
,"Syntelli Solutions, Inc",http://www.indeed.com/pagead/clk?mo=r&ad=-6NYlbfkN0Dqrr-Rjg2XLksGNbp1zr5zrpCZUmaYUPA5zQ_vrCj_X6a_99tNJpNpXW6b2-NnzR-s72LGlIrkkvWFRwr2frmiwkGfTVc8Qgg6uKo4D4z8Hcb6niEHqdp_J0Q9g6aYSoYTmug_FVffV-BytzsyRywaTafeOJa6SIuiSqvqUU_euehKDwuWMF9HwqmpJ-Ymlubpq9d4Jpbc5fNcPzhMMC6Euga_jdrp84AwECuziNP9v78XA7ruKbixOCtEawJ4iv3Fb7om7PxIckeR3J5hmOeO9971fIYF40UKyKWnRYDQDV-T68iT7JeF_nISpFr7vhEAwr779P5ZcfvPIzHBOD4NQQDL53JvowPh8wvmZif3rVnLllbwUibyseQXafGmCPN2Q2IdrNWnu4SYwxoqXfBopB472glYd19cbnzua_fT0Q==&p=4&sk=&fvj=1,"Charlotte, NC 28277",Senior/Lead Data Scientist:. 2+ years as Senior/Lead Data Scientist. Lead role in our very fast growing Data Science team from marketing analytics perspective....,Data Scientist
,RS Energy Group,http://www.indeed.com/pagead/clk?mo=r&ad=-6NYlbfkN0AH4CKTkdT7E9kgGwiXtXtW04LsQVpZIo66s4kKwqvZTs19CBU-WfuablWFA-ZRFrlupi55B-j6m7nyTCH8RGDG80ArvTQlgPWVEK66fO4m5yrXI147eteX_rz9xEtjLzbPOdCWLu9z3nqT-BxQUrhi__oRYh8jo3YAzYiv4zSd30H1o9KmwWTvcWc9r8uDFNTT3VLyktkjrN40nVYdixPhnuD0_t0alYHUBb5gOeW6AiUQ4cGiGV6_bKpkbnFg4l709MWhHI7P-xi8S-GJztXt1cWtAiX21x_057AXE_yhF2k-XQSsFhlTquRtYtMcytOD2Y4ty6c1Z-tnZ_UTv1xCSPEHpk_cUFZ9X1-4QyL6fd7uCoaVn4AgWdXhU9GjOWMvQ3iC_4p_o6NbXCXmERexiF9ZipbvC6MJoVheBKLC1UtD9QPYn9uA&p=5&sk=&fvj=1,"Plymouth Meeting, PA",Working alongside Data Scientists to productionalize advanced computer science algorithms like machine learning and natural language processing....,Data Engineer/Scientist
http://www.indeed.com/cmp/Novetta,Novetta,http://www.indeed.com/pagead/clk?mo=r&ad=-6NYlbfkN0DZbghDog6eAFViHltrtimeH7IE6OveQ-GQud_7SkddKZ31ufd3YNXn3pfpzCV9ckU8aF4FXEMdNMMuriPqwkORncW9ijpAUQMteJKA5qO_YPdZyJ6yQp__XO5UMaH6318gaUwG-w8bOd8Y2RsOBx_RauD8MPNbbgPCmRTjgUd-SMK17sKDbuR2L1lUlG94js7D5l_sz-JDeCGrFMy9KJkPOwc7Fk0P2WHgfYXm1Z-8TfsucgE7xX8TLH4oM_nYRF87fFzPqffEowo-wEjfdMc4TTe4Y_urmB3lCfWNsMlnEFcRs2vW5k5GakgfsJkK76zHPIJ72h6yo1-gS9-7JLmshaEQSQX1qNNstzPeFryOiAgS-4Y6tLBJj_w4UuwmcZRyGckD7mAD04ShRZE2-_9csaaHMeax701tq0Ug4XjmfCo5gI1nX4Vlkkf6AA0PadXAZpUXWd-5QD2gGA4iQs_XzMOx_72Y7zaKz3ETQ6xoVX44oL72gDZk3VHINx7XquIso07w5Q7AP34WOasEQKDwjDCKzohYulMCVIFPK-6ZSSyLXKP4tswQrZsUeFlVbFOb9OALBdJOux103Or02P9r9VAFvNaH0WHnAg93mugKXRveEialAFOknxqN9Vb6F2E-nFAzOCWRHDCC1fJQS_pK_2wxsp5r86qEXS-pbSWEc69zfs4Mjk2X6W0kFLU203rtY13L4loC8kmIu1oQeW0EintcsYwFf3RR7MYbrLGQ2_I1oZ9GeeB4kW1kUupYjJs3oMUsezgw6LURWAoDLkBaahplKWVcyNgkuJ0Iiuzbvv3JCZ04AxKjoZPHxYWIEEqnjMVfIX7zVIwqqRy5CKFX&p=1&sk=&fvj=0,"Crystal City, VA","Experience applying data mining and machine learning techniques in a professional context. Knowledge of data mining and machine learning algorithms, theories,...",Data Scientist
http://www.indeed.com/cmp/Walmart-Ecommerce,Walmart eCommerce,http://www.indeed.com/pagead/clk?mo=r&ad=-6NYlbfkN0ASqHCEO9GpEUGjkXl8JxXxJB8G4bxm4-V1wqiPq6GTVg0dexUg4LUC1Xvy-Hj3JfvgW6Kn5vqROfEP7DBmdabnwGqVZXSr7gqBOaZltwR5TlPJtKzwqE1-IO0CXhoGzDGP3SoNTUll16uKR-Ip-64n0Jbc1a35V0gO31HOwQqVV-6chqTXHLmo2RXuby6EyjTDyteK3xODvlkSa_EhVKqvKb53hO_B8bLtDwtliCWYTr0WxmgmgWdfd6SVOAJP8HHrh4TgOl5lh1-VPdZjDi07T7_m5hDkreziC07mLoEcX3Yg3Y9kopgmcos9ks3f42sPZ92tWDVfBmJQgeJVLHeLsitfz97Ow3av-M520UvfjHTI1Z1J5r1gEsGLF9Att7cNLGQmnlobEA4yL1927C7e&p=2&sk=&fvj=0,"San Bruno, CA 94066","We employ big data at scale -- from machine learning, data mining and optimization algorithms, to modeling and analyzing massive flows of data from online,...",Data Scientist
http://www.indeed.com/cmp/Engility-Corp,Engility Corporation,http://www.indeed.com/rc/clk?jk=2d9d7b83c2ee3f00&fccid=6ccb0eba9956b16a,"El Segundo, CA 90245","5 Years Experince with BS of Science Degree in Electrical, Mechanical or Aerospace Engineering or applied mathematics or applied physics or 3 Years with MS of...",Operations Research Analyst with TS/SCI Clearance
http://www.indeed.com/cmp/Precision-For-Value,Precision for Value,http://www.indeed.com/company/Precision-for-Value/jobs/Account-Executive-68ed1de1290447ba?fccid=7bb6931b3a51e34f,"New York, NY","At Precision, you will collaborate with teams that include former payers, data scientists, health economists, marketing strategists, and promotional...",Account Executive
http://www.indeed.com/cmp/Ascent-Services-Group,Ascent Services Group,http://www.indeed.com/rc/clk?jk=272bbe3c9fa6db05&fccid=55051b7d98da371e,"Cambridge, MA 02142 (East Cambridge area)","Associate Scientist II, Technician Development. This associate will be responsible for acquiring, analyzing, reporting, recording and presenting data within our...","Associate Scientist II, Technical Development"
http://www.indeed.com/cmp/City-of-Hope,City Of Hope,http://www.indeed.com/rc/clk?jk=8bfc78ce1007af3e&fccid=e4c4ad85ebf29819,"Duarte, CA 91010",California license as a Clinical Laboratory Scientist or Immunohematology limited license. Assist areas with the development of validation plans and documents...,Sr Manager Quality & Reg Affrs
,Eurofins Lancaster Laboratories Professional Scien...,http://www.indeed.com/rc/clk?jk=fd2525a4479e5f8b&fccid=d2ac45b4c130ed2d,"Spring House, PA","The candidate will record and analyze experimental data, verify data integrity and accuracy, and report/summarize findings to the project team, and also draft...",Downstream Scientist - Large Molecule
http://www.indeed.com/cmp/O'brien-&-Gere,O'Brien & Gere,http://www.indeed.com/rc/clk?jk=2bca54a52c475cea&fccid=ebb6a7608dce2f6f,"Syracuse, NY",OBG is currently seeking an engineer or scientist for our growing Environmental Health & Safety (EHS) practice....,Environmental Engineer
http://www.indeed.com/cmp/Beebe-Healthcare,Beebe Healthcare,http://www.indeed.com/rc/clk?jk=b7cc52acc74e0fe7&fccid=68ffc2bd3d4a840d,"Lewes, DE","Evaluates results and quality control data. Beebe Healthcare has become the premier healthcare facility in Sussex County, serving a thriving beach and vacation...",Med Tech/ Lab Scientist: Laboratory (Full Time)
http://www.indeed.com/cmp/California-Science-Center-Foundation,California Science Center Foundation,http://www.indeed.com/rc/clk?jk=1ee3dcc3cc67292d&fccid=ba88d518435b5286,"Los Angeles, CA","EndeavourLA will inspire a new generation of scientists, innovators and explorers. Send Cover Letter, Resume and Salary Target to the HR Dept....",Campaign Writer
http://www.indeed.com/cmp/The-University-of-Chicago,University of Chicago,http://www.indeed.com/rc/clk?jk=a3e7811e940a3e4b&fccid=5cb727313a823dd6,"Chicago, IL",Review data within divisional systems utilized for clinical research to ensure harmonization with a specific emphasis on EPIC and clinical trial management...,Amendment Manager
,Payette Group,http://www.indeed.com/rc/clk?jk=6214109488ac02be&fccid=0713d0f87189170a,"Palo Alto, CA 94301 (Professorville area)",Lead the effort in scaling and automating the analysis that predicts business performance.Work closely with Data Scientists to design and implement new/custom...,Software Engineer (Analytics)
http://www.indeed.com/cmp/Indeed,Indeed,http://www.indeed.com/pagead/clk?mo=r&ad=-6NYlbfkN0CiRNM7CVr8YueLFKlzwbFWI0o7IjV438l4sVrvKZ0fliTfoNv_ONF5FvJKNaJe41O5vUOqHByFV-Kbj5Y3ThgQQObxPdR8ypSHPTD0Fer3x1OFY1fvzVKlLPcdMTrwb68jqlrGSZRldd8bqmPUGuD29zOmRzUao7kIMmravwEp0uuhT6hhOxg2YA-Y_NzQKpR-IM-c5bWOkR3NXCU7CF0tLcwtpRaNbj6P_srZePRbmszTpm7weiThTHzCanrNQikPytUptWc7eRI3XnagCttWjvVsJ7kwV2P-BtE_xh8aEe5zdlp_b5OKRYyMA8fGfIQw0Av2Wj8OZEZBb5YbVUlvkoBUQEiSi0l2EozGgVZk2eczwj4D-WnfpttHoDMb2zDlVUd-lg7p-JcnDZo-BEutVrNvixp1b6UAdnjeNugEvtb-bZ4I8SmYE7UhEpkcE6Jr3EjiHw4dv2dD1S19Ju63VIkcbjd6d6CuOQHOc7yMNQ==&p=3&sk=&fvj=0,"Austin, TX 78731","As a Data Scientist at Indeed your role is to follow the data. We are looking for a mixture between a statistician, scientist, machine learning expert and...",Data Scientist
,"Syntelli Solutions, Inc",http://www.indeed.com/pagead/clk?mo=r&ad=-6NYlbfkN0Dqrr-Rjg2XLksGNbp1zr5zrpCZUmaYUPA5zQ_vrCj_X6a_99tNJpNpXW6b2-NnzR-s72LGlIrkkvWFRwr2frmiwkGfTVc8Qgg6uKo4D4z8Hcb6niEHqdp_J0Q9g6aYSoYTmug_FVffV-BytzsyRywaTafeOJa6SItsHUHgejM-R7q7N4Rgu5Wn10z5FheAGJmndu8bKvHqMBP9PF-5lxEFM0q-XRA1S6WFQtXPAUWC768PH6TcAPQuDx6r0shOfirTL1utOby5AUQtHSnCeSuKi8eVH9Cwi3US0IHS4dZHqqsowubfHuoySsVI85BYjYBfRecXvS_PnUd45HNAajDFNDLLQi6E0CL1MBZOnHqWItwL3ibedukxzJRzS250F7W9Pj3iGu6vusZRPOlRhXwzW4MCGZSih16evbmAkp0DzA==&p=4&sk=&fvj=1,"Charlotte, NC 28277",Senior/Lead Data Scientist:. 2+ years as Senior/Lead Data Scientist. Lead role in our very fast growing Data Science team from marketing analytics perspective....,Data Scientist
,RS Energy Group,http://www.indeed.com/pagead/clk?mo=r&ad=-6NYlbfkN0AH4CKTkdT7E9kgGwiXtXtW04LsQVpZIo66s4kKwqvZTs19CBU-WfuablWFA-ZRFrlupi55B-j6m7nyTCH8RGDG80ArvTQlgPWVEK66fO4m5yrXI147eteX_rz9xEtjLzbPOdCWLu9z3nqT-BxQUrhi__oRYh8jo3aZnRFu0oJUhQqfSeykHSnOTS-JkG2YRWKE_EiDof1fIxgzWCOaIma6ZPxvYnGaSsjA5MHPa_zs_Mb97wa80weQu1x6Ew5pjmTxdlRNutapg8_3EM_PxYYosR2bqDK9MQYOsNdSIvQyhbieTy0BNQvnp-gmBimM2ukXlorFiN97V8zTcPiy1cdsD4fg4L-zSnH5PkYp2mmEFtB0fyrdq8NUoaP_VtVAR1oaPP4WQWc6251m3ZEfHTM5E5GRqjUJxnUT9ZyEDVJk1RRrWtqmYU-H&p=5&sk=&fvj=1,"Plymouth Meeting, PA",Working alongside Data Scientists to productionalize advanced computer science algorithms like machine learning and natural language processing....,Data Engineer/Scientist
,RS Energy Group,http://www.indeed.com/pagead/clk?mo=r&ad=-6NYlbfkN0AH4CKTkdT7E9kgGwiXtXtW04LsQVpZIo66s4kKwqvZTs19CBU-WfuablWFA-ZRFrlupi55B-j6m7nyTCH8RGDG80ArvTQlgPWVEK66fO4m5yrXI147eteX_rz9xEtjLzbPOdCWLu9z3nqT-BxQUrhi__oRYh8jo3a6AvBy43AGQsuBepflQpHo3wjVwYG52APcQk5lD4AEPCxxuNzQnIokfDmQ0W804TRTcVbWlCBw_R8WeE4vftd1PmUHOd9nuSCJ0z-dbmh_aYf24oQ9VEm3PjUoMdT0CXwtP9DdSMYFvfqsvueRl8-n-o_9LDDFYzU1VgyTwcRd8pdAkyvw_FLeQvTyMwMfPl8wJO6PAHdMBivVYSDH1P_u9gFcYMloaAz4alFZjJbcBwhdPp1sqhKGlPvbPo5FZ_wqzqyvNK6o-_54d2aZTzb2&p=1&sk=&fvj=1,"Plymouth Meeting, PA",Working alongside Data Scientists to productionalize advanced computer science algorithms like machine learning and natural language processing....,Data Engineer/Scientist
